ab_hps_id,de_code,doe,region,region2,province,district,county,respondent_id,place_work,doi,k7_location,timestart,k9_interviewer_code,inte_resp_knowledge,result,result_otherspfy,k10_comment,hp101,hp102,hp103,hp103_advocacy_spcfy,hp103_otherspcfy,hp104,hp105,hp105_otherspcfy,hp106,hp106n1,hp106n2,hp106n3,hp106n4,hp106n5,hp106n6,hp201_1,hp201_2,hp201_3,hp201_4,hp201_5,hp201_6,hp201_5_ospcfy,hp202ra,hp202ua,hp202rb,hp202ub,hp202rc,hp202uc,hp202rd,hp202ud,hp202re,hp202ue,hp202rfi,hp202ufi,hp202rfii,hp202ufii,hp202rfiii,hp202ufiii,hp202rfiv,hp202ufiv,hp202rfv,hp202ufv,hp202rfv_spcfy,hp202ufv_spcfy,hp202rg,hp202ug,hp202rg_spcfy,hp202ug_spcfy,hp202rhi,hp202uhi,hp202rhii,hp202uhii,hp202rhiii,hp202uhiii,hp202rhiv,hp202uhiv,hp202rhv,hp202uhv,hp202rhv_spcfy,hp202uhv_spcfy,hp202ri,hp202ui,hp202rj,hp202uj,hp202rj_spcfy,hp202uj_spcfy,hp203ra1,hp203ra2,hp203ra3,hp203ra4,hp203ra5,hp203ua1,hp203ua2,hp203ua3,hp203ua4,hp203ua5,hp203rb1,hp203rb2,hp203rb3,hp203rb4,hp203rb5,hp203ub1,hp203ub2,hp203ub3,hp203ub4,hp203ub5,hp203rc1,hp203rc2,hp203rc3,hp203rc4,hp203rc5,hp203uc1,hp203uc2,hp203uc3,hp203uc4,hp203uc5,hp203rd1,hp203rd2,hp203rd3,hp203rd4,hp203rd5,hp203ud1,hp203ud2,hp203ud3,hp203ud4,hp203ud5,hp204rap,hp204ranp,hp204rbp,hp204rbnp,hp204rcp,hp204rcnp,hp204rdp,hp204rdnp,hp204rep,hp204renp,hp204rfp,hp204rfnp,hp204rgp,hp204rgnp,hp204rhp,hp204rhnp,hp204rp_spcfy,hp204rnp_spcfy,hp205ramin,hp205ramax,hp205rbmin,hp205rbmax,hp205rcmin,hp205rcmax,hp205rdmin,hp205rdmax,hp205remin,hp205remax,hp205rfmin,hp205rfmax,hp205rgmin,hp205rgmax,hp205rhmin,hp205rhmax,hp205rhmin_spcfy,hp205rhmax_spcfy,hp206rap,hp206ranp,hp206rbp,hp206rbnp,hp206rcp,hp206rcnp,hp206rdp,hp206rdnp,hp206rep,hp206renp,hp206rfp,hp206rfnp,hp206rgp,hp206rgnp,hp207uap,hp207uanp,hp207ubp,hp207ubnp,hp207ucp,hp207ucnp,hp207udp,hp207udnp,hp207uep,hp207uenp,hp207ufp,hp207ufnp,hp207ugp,hp207ugnp,hp207uhp,hp207uhnp,hp207up_spcfy,hp207unp_spcfy,hp208uamin,hp208uamax,hp208ubmin,hp208ubmax,hp208ucmin,hp208ucmax,hp208udmin,hp208udmax,hp208uemin,hp208uemax,hp208ufmin,hp208ufmax,hp208ugmin,hp208ugmax,hp208uhmin,hp208uhmax,hp208uhmin_spcfy,hp208uhmax_spcfy,hp209uap,hp209uanp,hp209ubp,hp209ubnp,hp209ucp,hp209ucnp,hp209udp,hp209udnp,hp209uep,hp209uenp,hp209ufp,hp209ufnp,hp209ugp,hp209ugnp,hp210rp,hp210rnp,hp211up,hp211unp,hp212rp,hp212rnp,hp213up,hp213unp,hp214r,hp214u,hp215ra,hp215ua,hp215rb,hp215ub,hp215rc,hp215uc,hp215rd,hp215ud,hp215re,hp215ue,hp215rf,hp215uf,hp215rg,hp215ug,hp215rh,hp215uh,hp215ri,hp215ui,hp215ri_spcfy,hp215ui_spcfy,hp301ra,hp301ua,hp301rb,hp301ub,hp301rc,hp301uc,hp301rd,hp301ud,hp301re,hp301ue,hp301rf,hp301uf,hp301rg,hp301ug,hp301rh,hp301uh,hp301ri,hp301ui,hp301ri_spcfy,hp301ui_spcfy,hp3021a,hp3022a,hp3023a,hp3024a,hp3025a,hp3026a,hp3027a,hp3021b,hp3022b,hp3023b,hp3024b,hp3025b,hp3026b,hp3027b,hp303p,hp303np,hp304rap,hp304ranp,hp304rbp,hp304rbnp,hp304rcp,hp304rcnp,hp304rdp,hp304rdnp,hp304rep,hp304renp,hp304rfp,hp304rfnp,hp304rgp,hp304rgnp,hp304rhp,hp304rhnp,hp304rp_spcfy,hp304rnp_spcfy,hp3051a,hp3052a,hp3053a,hp3054a,hp3055a,hp3056a,hp3057a,hp3051b,hp3052b,hp3053b,hp3054b,hp3055b,hp3056b,hp3057b,hp306p,hp306np,hp307uap,hp307uanp,hp307ubp,hp307ubnp,hp307ucp,hp307ucnp,hp307udp,hp307udnp,hp307uep,hp307uenp,hp307ufp,hp307ufnp,hp307ugp,hp307ugnp,hp307uhp,hp307uhnp,hp307up_spcfy,hp307unp_spcfy,hp308r,hp308u,hp309r,hp309u,hp310a,hp310b,hp310c,hp310d,hp310e,hp310f,hp310g,hp310h,hp310i,hp310j,hp310k,hp310k_spcfy,hp311a,hp311b,hp311c,hp311d,hp311e,hp311f,hp311g,hp311h,hp311i,hp311j,hp311j_spcfy,hp312,hp401a,hp401b,hp401c,hp401d,hp401e,hp401f,hp401g,hp401h,hp401i,hp401j,hp401k,hp401l,hp401m,hp401n,hp401o,hp401p,hp401x,hp401x_spcfy,hp402,hp403,hp404,hp405,hp406,hp407a,hp407b,hp407c,hp407d,hp407e,hp407f,hp407g,hp407h,hp407i,hp407j,hp407k,hp407l,hp407m,hp407n,hp407o,hp407x,hp407x_spcfy,ph501,ph502,ph503,ph504,ph505,hp506a,hp506b,hp506c,hp506d,hp506e,hp506f,hp506g,ph506,hp507a,hp507b,hp507c,hp507d,hp507e,hp507f,hp507g,hp507h,ph507h_spcfy,ph508,comment,k8_end_hh,k8_end_mm
37,Patrick,30aug2012,Central & Nairobi,Nairobi/Central,Nairobi,Nairobi West,Nairobi,37,NAIROBI,05jun2012,Urban,12:99,Prof. Lawrence Ikamari,Knows very well,Complete,,,Female,,Other- Non-medical,,,5,Private sector for profit,,No,,,,,,,Yes,No,No,Yes,No,No,,Don't Know,Don't Know,Don't Know,Don't Know,Yes,Yes,Don't Know,Missing,Yes,Yes,Missing,Missing,Yes,Yes,No,Yes,Yes,Yes,Missing,Missing,,,Missing,Missing,,,Don't Know,Don't Know,Don't Know,Don't Know,Don't Know,Don't Know,Don't Know,Don't Know,Don't Know,Don't Know,,,Missing,Missing,Missing,Missing,,,fii. Oral introduction of drugs- Herbs/ Teas/ Solutions,,,,,fii. Oral introduction of drugs- Herbs/ Teas/ Solutions,,,,,a. Dilation and Evacuation (D&E),,,,,a. Dilation and Evacuation (D&E),,,,,a. Dilation and Evacuation (D&E),,,,,a. Dilation and Evacuation (D&E),,,,,hii. Cervical/ Vaginal drugs- Herbs/Teas/ Solutions (Using form of insertion),,,,,hii. Cervical/ Vaginal drugs- Herbs/Teas/ Solutions (Using form of insertion),,,,,Sometimes,Never/ Rarely,Commonly,Sometimes,Sometimes,Never/ Rarely,Sometimes,Sometimes,Sometimes,Commonly,Sometimes,Sometimes,Sometimes,Commonly,,,,,500,1000,2000,5000,500,3000,500,3000,5000,50000,2000,5000,500,2000,,,,,,,,,,,,,,,,,,,,,,,,,,,,,,,,,,,,,,,,,,,,,,,,,,,,,,,,,,,,,,,,,,,,,,,,,,,,,,,,,,,,,,,,,,,,,,,,,,,,,,,,,,,,,,,,,,,,,,,,,,,,,,,,,,,,,,,,,,,,,,,,,,,,,,,,,,,,,,,,,,,,,,,,,,,,,,,,,,,,,,,,,,,,,,,,,,,,,,,,,,,,,,,,,,,,,,,No,No,No,No,No,No,No,,,,,No,No,No,Yes,,No,,,,,,,No,No,No,,No,No,No,,,,,No,No,No,No,No,,,,,,,No,No,No,No,No,No,No,,,,,,,,,,,,,,
40,Patrick,30aug2012,Central & Nairobi,Nairobi/Central,Nairobi,Nairobi West,Nairobi,40,CBD,09jul2012,Urban,,Prof. Lawrence Ikamari,Knows very well,Complete,,,Female,44,Clinical Officer,,,16,Private sector for profit,,No,,,,,,,No,Yes,No,Yes,No,No,,Yes,Yes,Yes,Yes,Yes,Yes,Missing,Missing,Yes,Yes,Missing,Missing,Yes,Yes,Missing,Missing,Yes,Yes,Missing,Missing,,,Missing,Missing,,,Missing,Missing,Missing,Missing,Yes,Yes,Missing,Missing,Missing,Missing,,,Missing,Missing,Missing,Missing,,,fii. Oral introduction of drugs- Herbs/ Teas/ Solutions,,,,,fii. Oral introduction of drugs- Herbs/ Teas/ Solutions,,,,,a. Dilation and Evacuation (D&E),b. Dilation and curettage (D&C),,,,a. Dilation and Evacuation (D&E),b. Dilation and curettage (D&C),,,,a. Dilation and Evacuation (D&E),b. Dilation and curettage (D&C),,,,a. Dilation and Evacuation (D&E),b. Dilation and curettage (D&C),,,,hii. Cervical/ Vaginal drugs- Herbs/Teas/ Solutions (Using form of insertion),,,,,hii. Cervical/ Vaginal drugs- Herbs/Teas/ Solutions (Using form of insertion),,,,,Commonly,Never/ Rarely,Sometimes,Sometimes,Never/ Rarely,Sometimes,Sometimes,Sometimes,Never/ Rarely,Commonly,Never/ Rarely,Sometimes,Sometimes,Sometimes,,,,,2000,3000,5000,10000,3000,5000,5000,10000,10000,50000,3000,5000,0,0,,,,,30,25,20,20,20,20,10,0,5,30,5,0,10,5,Commonly,Never/ Rarely,Sometimes,Sometimes,Never/ Rarely,Never/ Rarely,Sometimes,Sometimes,Never/ Rarely,Commonly,Sometimes,Sometimes,Commonly,Sometimes,,,,,3000,6000,8000,15000,,,8000,15000,10000,60000,3000,5000,0,0,,,,,30,10,15,20,5,10,20,25,15,25,5,5,10,5,,,,,,,,,,,,,,,,,,,,,,,,,,,,,,,,,,,,,,,,,,,,,,,,,,,,,,,,,,,,,,,,,,,,,,,,,,,,,,,,,,,,,,,,,,,,,,,,,,,,,,,,,,,,,,,,,,,,,,,,,,,,,,,,,,,,,,,,,,,,,,,,,,,No,No,No,No,No,No,No,,,,,No,No,No,Yes,,No,,,,,,,No,No,No,,No,No,No,,,,,No,No,No,No,No,,,,,,,No,No,No,No,No,No,No,,,,,,,,,,,,,,
39,Patrick,30aug2012,Central & Nairobi,Nairobi/Central,Nairobi,Nairobi West,Nairobi,39,MISSING,24may2012,Urban,,Prof. Lawrence Ikamari,Knows very well,Complete,,,Male,34,Missing,,,7,Public sector (Govt),,No,,,,,,,No,No,Yes,No,No,No,,Yes,Yes,Don't Know,Yes,Yes,Yes,No,Yes,Yes,Yes,Yes,Yes,Yes,Yes,Yes,Yes,Yes,Yes,Missing,Missing,,,Missing,Missing,,99,Yes,Yes,Yes,Yes,Yes,Yes,Yes,Yes,Missing,Yes,,,Yes,Yes,Missing,Missing,,,fii. Oral introduction of drugs- Herbs/ Teas/ Solutions,,,,,fii. Oral introduction of drugs- Herbs/ Teas/ Solutions,,,,,a. Dilation and Evacuation (D&E),,,,,a. Dilation and Evacuation (D&E),,,,,a. Dilation and Evacuation (D&E),,,,,a. Dilation and Evacuation (D&E),,,,,hii. Cervical/ Vaginal drugs- Herbs/Teas/ Solutions (Using form of insertion),,,,,hii. Cervical/ Vaginal drugs- Herbs/Teas/ Solutions (Using form of insertion),,,,,Commonly,Sometimes,Never/ Rarely,Sometimes,Never/ Rarely,Sometimes,Never/ Rarely,Sometimes,Never/ Rarely,Sometimes,Never/ Rarely,Commonly,Sometimes,Sometimes,,,,,2000,5000,5000,10000,3500,5000,3000,5000,4000,40000,3000,5000,0,0,,,,,,4.7619047,,9.5238094,,33.333332,,23.809525,,14.285714,,9.5238094,,4.7619047,,,,,,,,,,,,,,,,,,,,,,,,,,,,,,,,,,,,,,,,,,,,,,,,,,,,,,,,,,,,,,,,,,,,,,,,,,,,,,,,,,,,,,,,,,,,,,,,,,,,,,,,,,,,,,,,,,,,,,,,,,,,,,,,,,,,,,,,,,,,,,,,,,,,,,,,,,,,,,,,,,,,,,,,,,,,,,,,,,,,,,,,,,,,,,,,,,,,,No,No,No,No,No,No,No,,,,,No,No,No,Yes,,No,,,,,,,No,No,No,,No,No,No,,,,,No,No,No,No,No,,,,,,,No,No,No,No,No,No,No,,,,,,,,,,,,,,
46,Patrick,30aug2012,Rift valley,Other regions,Rift Valley,Eldoret East,Uasin Gishu,46,LANGAS HEALTH CENTRE,10jul2012,Urban,02:30,Dr. Emilly Mwaliko,Knows very well,Complete,,,Female,26,Nurse,,,1,Public sector (Govt),,No,,,,,,,Yes,No,No,No,No,No,,No,Yes,No,Yes,No,Yes,No,Yes,No,Yes,Missing,No,Yes,No,Yes,No,No,No,Missing,Missing,,,Missing,No,,,No,No,Yes,No,No,No,No,No,Missing,Missing,,,No,No,Missing,Missing,,,,,,,,,,,,,,,,,,,,,,,,,,,,,,,,,,,,,,,,,,,Commonly,Never/ Rarely,Never/ Rarely,Commonly,Sometimes,Sometimes,Never/ Rarely,Sometimes,Never/ Rarely,Never/ Rarely,Never/ Rarely,Never/ Rarely,Never/ Rarely,Commonly,,,,,1000,1500,2500,3000,2500,2500,3000,3500,,,,,200,500,,,,,25,5,20,40,20,10,25,20,0,0,5,5,5,20,Never/ Rarely,Never/ Rarely,Commonly,Commonly,Sometimes,Sometimes,Sometimes,Sometimes,Sometimes,Commonly,Never/ Rarely,Never/ Rarely,Sometimes,Never/ Rarely,,,,,,,3000,5000,3000,4000,3000,4000,5000,10000,,,500,1000,,,,,5,5,50,40,10,10,10,10,15,25,5,5,5,5,20,30,40,50,70,80,80,90,3,4,Yes,No,Yes,No,No,No,No,Yes,No,No,No,Yes,No,Yes,No,No,No,No,,,Commonly,Commonly,Commonly,Commonly,Commonly,Commonly,Commonly,Commonly,Sometimes,Sometimes,Sometimes,Commonly,Sometimes,Sometimes,Commonly,Commonly,,,,,7,3,3,2,0,2,6,6,2,2,1,,2,5,5,6,Sometimes,Never/ Rarely,Sometimes,Commonly,Sometimes,Commonly,Sometimes,Commonly,Never/ Rarely,Never/ Rarely,Sometimes,Commonly,,,,,,,7,5,6,4,0,3,6,6,4,4,3,0,2,6,6,7,Sometimes,Never/ Rarely,Commonly,Commonly,Commonly,Commonly,Sometimes,Commonly,Never/ Rarely,Sometimes,Sometimes,Sometimes,,,,,,,6,8,5,8,Sometimes,Sometimes,Never/Rarely,Sometimes,Never/Rarely,Sometimes,Commonly,Sometimes,Sometimes,Commonly,,,Commonly,,Sometimes,Commonly,Commonly,Never/Rarely,Commonly,Commonly,Commonly,,,8,Yes,Yes,No,No,Yes,No,No,No,No,Yes,No,No,Yes,No,No,No,No,,Few of them,Most of them,All,Yes,Yes,Yes,No,Yes,No,No,No,No,No,No,No,No,No,No,No,No,No,,Abortion  Is Not Permitted Unless In The Opinion Of A Healthprofessional The Life Or The Mother Is At Risk And Should Beperformed In An Hospital Set Up By A Trained Medical Practioner And With The Consent Of Of Two Other Medical Practioners.,Induction Abortion Was Allowed When The Pregnancy Poses A Risk To The Life Or Health Of The Mother .Perfprmed In Hospital By Qualified Medical Practicioner S,There Was No Change,Not Changed Anything,"Counselling Women Of Reproduction Age On Fp,Dangers Of Abortion ,Hiv,Sti'S.",Yes,No,No,No,No,No,No,,Yes,No,Yes,No,No,No,No,No,,Create Awareness Of Sti'S As Well As Hiv As Part Of Pac Counselling.Special Centres For Pac Services .Equip All The Facilities With Pac Care/Mva Equipment,,4,0
41,Patrick,30aug2012,Rift valley,Other regions,Rift Valley,Eldoret East,Uasin Gishu,41,MOI UNIVERSITY /MTRH,08may2012,Urban,03:15,Dr. Emilly Mwaliko,Knows very well,Complete,,"Q212,213-All Will Have Compl All Bleed And Provider May Be Trained But Not Have An Enabling Environment.Q301-Pain Is Not A Complication?.Q304-Women Self-Induced Is Not A Provider.Q204(G)-Difficult To",Male,35,Researcher,,,6,Public sector (Govt),,Yes,Garissa,Mosoriot,B/Forest,,,,Yes,No,Yes,Yes,No,No,,No,No,No,Yes,No,Yes,No,Don't Know,Yes,Yes,No,Yes,Yes,Yes,Yes,No,Yes,Yes,Missing,Missing,,,Don't Know,Don't Know,,,Don't Know,Don't Know,Yes,Don't Know,No,Yes,Yes,Yes,Missing,Missing,,,Don't Know,Don't Know,Missing,Missing,,,"hiv.Cervical/ Vaginal drugs- Piercing objects (e.g. sticks, wires, knitting needles)",,,,,"hiv.Cervical/ Vaginal drugs- Piercing objects (e.g. sticks, wires, knitting needles)",,,,,b. Dilation and curettage (D&C),e. Medication abortion (e.g. Cytotec/misoprostol),hiii. Cervical/ Vaginal drugs- Catheter,,e. Medication abortion (e.g. Cytotec/misoprostol),b. Dilation and curettage (D&C),e. Medication abortion (e.g. Cytotec/misoprostol),hiii. Cervical/ Vaginal drugs- Catheter,,,c. Manual vacuum aspiration (MVA),e. Medication abortion (e.g. Cytotec/misoprostol),,,,c. Manual vacuum aspiration (MVA),e. Medication abortion (e.g. Cytotec/misoprostol),,,,"hiv.Cervical/ Vaginal drugs- Piercing objects (e.g. sticks, wires, knitting needles)",,,,,,,,,,Commonly,,Sometimes,Commonly,Commonly,Commonly,Commonly,,Never/ Rarely,Commonly,Never/ Rarely,,Never/ Rarely,Never/ Rarely,Sometimes,Sometimes,,,200,500,500,1000,500,1000,500,1000,1000,2000,,,0,0,0,0,,,60,7,10,30,15,40,10,20,0,0,2,2,3,1,Never/ Rarely,Never/ Rarely,Commonly,Sometimes,Commonly,Sometimes,Commonly,Sometimes,Sometimes,Commonly,Sometimes,Commonly,Commonly,Commonly,,,,,,,2000,3000,1500,2000,1500,2000,2000,10000,200,500,0,0,,,,,,,,,,,,,,,,,,,,,,,,,,,,,,,,,,,,,,,,,,,,,,,,,,,,,,,,,,,,,,,,,,,,,,,,,,,,,,,,,,,,,,,,,,,,,,,,,,,,,,,,,,,,,,,,,,,,,,,,,,,,,,,,,,,,,,,,,,,,,,,,,,,,,,,,,,,,,,,,,,,,,No,No,No,No,No,No,No,,,,,No,No,No,Yes,,No,,,,,,,No,No,No,,No,No,No,,,,,No,No,No,No,No,,,,,,,No,No,No,No,No,No,No,,,,,,,,,,,,,,
49,Patrick,30aug2012,Rift valley,Other regions,Rift Valley,Eldoret East,Uasin Gishu,49,CLINICAL OFFICER MOI UNIVERSITY MEDICAL SERVICES,18jul2012,Rural,10:00,Dr. Emilly Mwaliko,Knows very well,Complete,,,Male,59,Clinical Officer,,,27,Public sector (Govt),,Yes,,,,,,,Yes,Yes,No,No,No,No,,No,Yes,No,Yes,No,Yes,No,Don't Know,No,Yes,Don't Know,Yes,Yes,Yes,Yes,Don't Know,Yes,Yes,Missing,Missing,,,Don't Know,Don't Know,,,Don't Know,Don't Know,Yes,Don't Know,No,Yes,Yes,Yes,Missing,Missing,,,Missing,Don't Know,Missing,Missing,,,fii. Oral introduction of drugs- Herbs/ Teas/ Solutions,"hiv.Cervical/ Vaginal drugs- Piercing objects (e.g. sticks, wires, knitting needles)",,,,fii. Oral introduction of drugs- Herbs/ Teas/ Solutions,"hiv.Cervical/ Vaginal drugs- Piercing objects (e.g. sticks, wires, knitting needles)",,,,c. Manual vacuum aspiration (MVA),,,,,c. Manual vacuum aspiration (MVA),b. Dilation and curettage (D&C),,,,c. Manual vacuum aspiration (MVA),,,,,c. Manual vacuum aspiration (MVA),b. Dilation and curettage (D&C),,,,hii. Cervical/ Vaginal drugs- Herbs/Teas/ Solutions (Using form of insertion),f i. Oral introduction of drugs- Hormonal drugs (e.g. Contraceptive pills),e. Medication abortion (e.g. Cytotec/misoprostol),,,f i. Oral introduction of drugs- Hormonal drugs (e.g. Contraceptive pills),e. Medication abortion (e.g. Cytotec/misoprostol),hii. Cervical/ Vaginal drugs- Herbs/Teas/ Solutions (Using form of insertion),,,Commonly,Never/ Rarely,Sometimes,Sometimes,Commonly,Sometimes,Sometimes,Commonly,Never/ Rarely,Sometimes,Never/ Rarely,Never/ Rarely,Commonly,Sometimes,,,,,500,1000,500,1000,500,1000,500,1000,0,0,,,100,2000,,,,,50,20,10,10,15,10,15,25,0,10,0,5,10,20,Commonly,Sometimes,Sometimes,Sometimes,Commonly,Commonly,Commonly,Commonly,Never/ Rarely,Sometimes,Never/ Rarely,Sometimes,Commonly,Sometimes,,,,,1000,2000,3000,5000,2000,5000,2000,5000,5000,10000,500,1000,500,1000,,,,,20,10,10,20,20,20,15,20,20,15,5,5,10,10,50,60,40,70,80,80,80,90,3,5,Yes,Yes,No,No,Yes,No,No,Yes,No,No,No,No,No,Yes,Yes,No,No,No,,,Commonly,Commonly,Sometimes,Commonly,Commonly,Sometimes,Commonly,Sometimes,Sometimes,Sometimes,Sometimes,Sometimes,Sometimes,Sometimes,Commonly,Commonly,,,,,5,2,2,2,0,0,5,5,2,2,2,0,0,5,6,8,Commonly,Sometimes,Sometimes,Commonly,Sometimes,Commonly,Sometimes,Commonly,Never/ Rarely,Never/ Rarely,Never/ Rarely,Never/ Rarely,,,,,,,4,1,1,1,1,5,3,2,1,1,1,1,2,2,8,10,Sometimes,Sometimes,Sometimes,Commonly,Sometimes,Commonly,Sometimes,Commonly,Sometimes,Commonly,Sometimes,Commonly,,,,,,,6,8,8,10,Sometimes,Sometimes,Sometimes,Sometimes,Sometimes,Sometimes,Sometimes,Commonly,Commonly,,,,Commonly,Commonly,Commonly,Commonly,Commonly,Commonly,Commonly,Commonly,Commonly,,,7,No,No,No,No,Yes,Yes,No,No,No,Yes,Yes,No,Yes,No,No,No,Yes,Tradition Methods,Most of them,Few of them,All,Yes,Yes,No,No,No,No,No,No,No,No,No,No,No,No,No,No,No,Yes,All Methods Are Relevant.It Depends On A Woma,Abortion Is Illegal.Everyone Has A Right To Life.Only A Professional Doctor Can Offer These Services .,There Was No Mention Of Abortion In The Old.It Was In Thepenel Code.,Kenyans Wanted It Clear In The Constitution That Abortion Isillegal That Is Why It Had To Be Put On The Constitution.,Abortion Can Be Procured But Only Through A Professional  .,Train Staff On This Procedurescreate Awareness About Abortion And Advantages Of Using H/Professionals.Make The Law Understandable To The People On How To Procuresafe Abortion,Yes,No,No,No,No,No,No,,Yes,No,No,Yes,No,No,No,Yes,Training ;Involve Churches To Educate Their Members On Issues Of Abortion.,Facilities -Should Be Improved To Cater For This Services.Management Of Pills-Drugs(Shortage)Inadeguate Staff(Trained)Provide Guidelines On The Management Of Pac,,11,30
51,Patrick,30aug2012,Rift valley,Other regions,Rift Valley,Eldoret East,Uasin Gishu,51,MTRH IN CHARGE OF WARD,26jun2012,Urban,01:00,Dr. Emilly Mwaliko,Knows very well,Complete,,,Female,45,Researcher,,,13,Public sector (Govt),,Yes,,,,,,,Yes,No,No,No,No,No,,No,Yes,No,Yes,No,Yes,No,Yes,Yes,Yes,Yes,Missing,Yes,Missing,Yes,Missing,Yes,Missing,Missing,Missing,,,Don't Know,Don't Know,,,Missing,Missing,Yes,Missing,Missing,Missing,Yes,Don't Know,Missing,Missing,,,No,No,Missing,Missing,,,fii. Oral introduction of drugs- Herbs/ Teas/ Solutions,,,,,e. Medication abortion (e.g. Cytotec/misoprostol),,,,,e. Medication abortion (e.g. Cytotec/misoprostol),,,,,e. Medication abortion (e.g. Cytotec/misoprostol),,,,,c. Manual vacuum aspiration (MVA),,,,,e. Medication abortion (e.g. Cytotec/misoprostol),,,,,hii. Cervical/ Vaginal drugs- Herbs/Teas/ Solutions (Using form of insertion),fiii. Oral introduction of drugs- Caustic agents (e.g. Washing detergent),"hiv.Cervical/ Vaginal drugs- Piercing objects (e.g. sticks, wires, knitting needles)",,,b. Dilation and curettage (D&C),c. Manual vacuum aspiration (MVA),,,,Commonly,Never/ Rarely,Sometimes,Commonly,Sometimes,Commonly,Sometimes,Commonly,Never/ Rarely,Sometimes,Sometimes,Sometimes,Commonly,Sometimes,,,,,500,1000,2000,3000,2000,3000,2000,3000,0,0,3000,5000,200,300,,,,,20,10,20,20,10,20,20,25,0,0,20,20,10,5,Never/ Rarely,Never/ Rarely,Sometimes,Sometimes,Sometimes,Sometimes,Sometimes,Sometimes,Commonly,Commonly,Sometimes,Sometimes,Never/ Rarely,Never/ Rarely,,,,,,,3000,5000,3000,5000,3000,5000,5000,10000,2000,2500,,,,,,,0,0,20,20,10,5,20,5,40,60,10,10,0,0,10,30,50,50,60,80,90,90,3,1,Yes,No,Yes,No,Yes,Yes,Yes,Yes,No,Yes,No,Yes,Yes,No,Yes,No,No,No,,,Commonly,Sometimes,Commonly,Sometimes,Commonly,Sometimes,Commonly,Sometimes,Sometimes,Sometimes,Sometimes,Sometimes,Sometimes,Sometimes,Commonly,Commonly,,,,,7,3,3,3,1,3,8,7,3,3,3,1,3,8,4,6,Sometimes,Never/ Rarely,Sometimes,Sometimes,Sometimes,Never/ Rarely,Sometimes,Never/ Rarely,Sometimes,Commonly,Sometimes,Sometimes,,,,,,,3,3,3,3,1,3,5,,2,2,2,0,2,4,7,10,Never/ Rarely,Never/ Rarely,Sometimes,Never/ Rarely,Never/ Rarely,Never/ Rarely,Never/ Rarely,Never/ Rarely,Commonly,Commonly,Never/ Rarely,Never/ Rarely,,,,,,,3,8,7,10,Commonly,Commonly,,Sometimes,Commonly,Commonly,Never/Rarely,Sometimes,Commonly,Commonly,,,Commonly,Commonly,Commonly,Commonly,Commonly,Commonly,Commonly,Commonly,Commonly,,,8,No,No,Yes,Yes,No,No,No,No,No,No,No,No,No,No,No,No,No,,Few of them,Few of them,All,Yes,Yes,No,Yes,No,No,No,No,No,No,No,No,No,No,No,No,No,No,,Allowed For The Benefit Of The Women/Patient,The Old Was A Criminal Offence,Nothing Changed Because Doctors Used To Perform It Anyway  When The Mother'S Life Is In Danger.,"No,It Is Still Not Performed In The Open.",Abortion Should Be Made Legal.Once The Patient Decides She Needs It It Should Be Done Otherwise It Will Still Need To Unsafe Abortion .,No,No,No,No,No,No,Yes,"After Counselling The Woman And She Still Feels She Should Not Carry The Pregnancy,She Should Be Allowed To Terminate.If Couple They Should Make Decision Both Of Them .In The Under Age ,The Parents Make Decision",Yes,Yes,Yes,No,Yes,Yes,No,No,,Service Made Cheap /Accessible Affortabledestigmatise Abortion Carefp Services Should Be Available At Or Immediately After Abortion,,2,0
56,Patrick,30aug2012,Rift valley,Other regions,Rift Valley,Eldoret East,Uasin Gishu,56,"DEAN SCHOOL OF PUBLIC HEALTH,MOI UNIVERSITY",27jul2012,Urban,03:30,Dr. Emilly Mwaliko,Knows moderately well,Complete,,"Not Sure What Women Would Pay To Any Provider Forprocuring An Abortion,.",Female,59,Researcher,,,15,Public sector (Govt),,No,,,,,,,No,No,Yes,No,No,No,,Don't Know,Don't Know,Don't Know,Don't Know,Don't Know,Don't Know,Don't Know,Don't Know,Don't Know,Don't Know,Don't Know,Yes,Yes,Don't Know,Don't Know,Don't Know,Don't Know,Don't Know,Don't Know,Don't Know,,,Don't Know,Don't Know,,,Don't Know,Yes,Yes,Don't Know,Don't Know,Don't Know,Yes,Yes,Missing,Missing,,,Yes,Don't Know,Missing,Missing,,,fii. Oral introduction of drugs- Herbs/ Teas/ Solutions,,,,,fii. Oral introduction of drugs- Herbs/ Teas/ Solutions,,,,,,,,,,,,,,,,,,,,,,,,,hii. Cervical/ Vaginal drugs- Herbs/Teas/ Solutions (Using form of insertion),,,,,hii. Cervical/ Vaginal drugs- Herbs/Teas/ Solutions (Using form of insertion),,,,,Commonly,Commonly,Sometimes,Sometimes,Sometimes,Sometimes,Sometimes,Sometimes,Never/ Rarely,Never/ Rarely,Never/ Rarely,Never/ Rarely,Commonly,Commonly,,,,,0,0,0,0,0,0,0,0,,,,,0,0,,,,,25,25,5,5,5,5,5,5,5,5,5,5,50,50,Never/ Rarely,Never/ Rarely,Sometimes,Sometimes,Sometimes,Sometimes,Sometimes,Sometimes,Sometimes,Sometimes,Sometimes,Sometimes,Commonly,Commonly,,,,,,,0,0,0,0,0,0,0,0,0,0,0,0,,,,,25,25,5,5,5,5,5,5,5,5,5,5,50,50,0,0,0,0,2,2,5,5,2,5,Yes,Yes,No,No,No,No,Yes,Yes,No,No,Yes,Yes,No,No,No,No,No,No,,,Commonly,Commonly,Commonly,Commonly,Commonly,Commonly,Commonly,Commonly,Commonly,Commonly,Commonly,Commonly,Commonly,Commonly,Commonly,Commonly,Commonly,Commonly,,,5,4,4,4,2,6,10,5,4,4,4,2,6,10,5,5,Never/ Rarely,Never/ Rarely,Commonly,Commonly,Commonly,Commonly,Sometimes,Commonly,Commonly,Commonly,Sometimes,Commonly,,,,,,,5,4,4,4,2,6,10,5,4,4,4,2,6,10,7,7,Never/ Rarely,Never/ Rarely,Commonly,Commonly,Commonly,Commonly,Commonly,Commonly,Commonly,Commonly,Commonly,Commonly,,,,,,,8,10,10,10,Commonly,Commonly,Commonly,Commonly,Commonly,Commonly,Commonly,Commonly,Commonly,Commonly,Commonly,Missing,Commonly,Never/Rarely,Commonly,Commonly,Commonly,Commonly,Commonly,Commonly,Commonly,,,5,No,No,No,No,Yes,No,No,No,No,Yes,Yes,No,No,No,No,No,No,,Few of them,Few of them,All,Yes,Yes,Yes,No,Yes,No,No,No,No,No,No,No,No,No,No,No,No,No,,Only Of A Woman'S Health Is At Risk,Not Sure,,Not Sure,Not Sure,Yes,No,No,Yes,Yes,Yes,No,,Yes,No,Yes,No,No,No,No,No,,Better Access To Health Care .,,4,25
