76,Kibowen,30aug2012,Central & Nairobi,Nairobi/Central,Nairobi,Nairobi North,Nairobi,76,IN HURUMA IN APRIVATE NURSING HOME AS ACLINICIAN,27aug2012,Urban,14:10,Eugene/Caroline Egesa,Knows very well,Complete,,,Male,30,Clinical Officer,,,3,Private sector for profit,,Yes,Garissa,,,,,,Yes,Yes,Yes,Yes,No,Yes,,No,Yes,No,No,No,Yes,No,Yes,Yes,Yes,Yes,Yes,Yes,No,No,Yes,Yes,Yes,Missing,Missing,,,Missing,Missing,,,Yes,No,Yes,No,No,Yes,Yes,Yes,Missing,Missing,,,Yes,No,Missing,Missing,,,fii. Oral introduction of drugs- Herbs/ Teas/ Solutions,"i. Heavy massage/physical exertion, physical blows, jumping, falling, marching",,,,e. Medication abortion (e.g. Cytotec/misoprostol),,,,,e. Medication abortion (e.g. Cytotec/misoprostol),c. Manual vacuum aspiration (MVA),,,,e. Medication abortion (e.g. Cytotec/misoprostol),c. Manual vacuum aspiration (MVA),,,,c. Manual vacuum aspiration (MVA),e. Medication abortion (e.g. Cytotec/misoprostol),hiii. Cervical/ Vaginal drugs- Catheter,,,d. Electric vacuum aspiration (EVA),e. Medication abortion (e.g. Cytotec/misoprostol),c. Manual vacuum aspiration (MVA),,,"fiv. Oral introduction of drugs- Overdose of pharmaceuticals (e.g. Quinine, SP 3 tablets)",fii. Oral introduction of drugs- Herbs/ Teas/ Solutions,"i. Heavy massage/physical exertion, physical blows, jumping, falling, marching",,,e. Medication abortion (e.g. Cytotec/misoprostol),"i. Heavy massage/physical exertion, physical blows, jumping, falling, marching","fiv. Oral introduction of drugs- Overdose of pharmaceuticals (e.g. Quinine, SP 3 tablets)",,,Commonly,Never/ Rarely,Never/ Rarely,Commonly,Never/ Rarely,Commonly,Sometimes,Never/ Rarely,Never/ Rarely,Commonly,Never/ Rarely,Commonly,Commonly,Never/ Rarely,,,,,800,1200,2000,3000,1000,2000,1000,1500,3000,5000,800,2000,100,500,,,,,20,5,5,25,10,15,23,4,2,40,30,10,10,1,Commonly,Never/ Rarely,Never/ Rarely,Sometimes,Commonly,Sometimes,Sometimes,Never/ Rarely,Never/ Rarely,Commonly,Commonly,Commonly,Never/ Rarely,Never/ Rarely,,,,,1000,1500,2000,3000,1500,2000,1000,2000,6000,10000,1000,1500,,,,,,,12,2,5,25,10,20,30,3,5,38,25,10,13,2,5,55,7,80,80,99,75,99,3,7,Yes,No,No,No,No,No,Yes,No,No,Yes,No,No,No,No,Yes,Yes,No,No,,,Commonly,Commonly,Commonly,Commonly,Commonly,Commonly,Commonly,Commonly,Sometimes,Sometimes,Commonly,Commonly,Commonly,Commonly,Commonly,Commonly,,,,,4,1,2,5,1,8,9,5,1,3,6,1,7,9,3,9,Commonly,Never/ Rarely,Never/ Rarely,Commonly,Never/ Rarely,Commonly,Commonly,Never/ Rarely,Never/ Rarely,Commonly,Commonly,Commonly,Commonly,Commonly,,,,,5,2,3,4,1,8,9,5,1,2,5,1,8,9,4,10,Commonly,Never/ Rarely,Never/ Rarely,Commonly,Never/ Rarely,Commonly,Commonly,Never/ Rarely,Never/ Rarely,Commonly,Commonly,Commonly,Commonly,Commonly,,,,,2,8,4,7,Commonly,Commonly,Commonly,Commonly,Commonly,Commonly,Commonly,Commonly,Commonly,Commonly,Commonly,Physical Trauma,Commonly,Commonly,Commonly,Commonly,Commonly,Commonly,Commonly,,,,,8,Yes,Yes,No,No,No,No,No,No,No,Yes,Yes,No,Yes,No,No,Yes,No,,Few of them,Most of them,All,Yes,No,No,No,Yes,Yes,No,No,No,No,No,No,No,No,No,No,No,No,,It Illegalises Abortion With An Exeption To Be Done When There Is An Emergency In Awoman Health,Old Strictly Illegalised Abortion But The New One Gives A Loop Hole Incase Of Emergency It Can Be Conducted,"The New One Is Abit Sraight Forward, Women With Health Riskcan Access It",Not Influenced,Public Be Made Aware On Importance Of Safe Abortion And Thedisadvantages Of Unsafe Abortion,Yes,Yes,No,No,Yes,Yes,No,,Yes,No,Yes,No,No,Yes,No,No,,Creat Specific Department Mainly Talking On Pac Casesavailability Of Equipment To Tackle Pac Cases In Our Healthfacilities,No Comment,15,24
77,Kibowen,30aug2012,Central & Nairobi,Nairobi/Central,Nairobi,Nairobi North,Nairobi,77,IN HURUMA OPERATES A PRIVATE CLINIC AND CHEMIST,27aug2012,Urban,15:30,Eugene/Caroline Egesa,Knows very well,Complete,,,Female,32,Clinical Officer,,,8,Private sector for profit,,Yes,Kisii - Keroka,,,,,,Yes,Yes,Yes,Yes,No,Yes,,No,No,No,No,No,Yes,Don't Know,Don't Know,No,Yes,Yes,No,Yes,No,Yes,No,Yes,No,Missing,Missing,,,Missing,Missing,,,No,Yes,No,No,Yes,Yes,No,Missing,Missing,Missing,,,No,No,Missing,Missing,,,fii. Oral introduction of drugs- Herbs/ Teas/ Solutions,,,,,e. Medication abortion (e.g. Cytotec/misoprostol),c. Manual vacuum aspiration (MVA),fii. Oral introduction of drugs- Herbs/ Teas/ Solutions,,,c. Manual vacuum aspiration (MVA),"fiv. Oral introduction of drugs- Overdose of pharmaceuticals (e.g. Quinine, SP 3 tablets)",,,,c. Manual vacuum aspiration (MVA),e. Medication abortion (e.g. Cytotec/misoprostol),,,,c. Manual vacuum aspiration (MVA),,,,,c. Manual vacuum aspiration (MVA),e. Medication abortion (e.g. Cytotec/misoprostol),,,,"fiv. Oral introduction of drugs- Overdose of pharmaceuticals (e.g. Quinine, SP 3 tablets)",,,,,e. Medication abortion (e.g. Cytotec/misoprostol),,,,,Commonly,Commonly,Never/ Rarely,Sometimes,Sometimes,Sometimes,Sometimes,Sometimes,Never/ Rarely,Never/ Rarely,Never/ Rarely,Never/ Rarely,Commonly,Commonly,,,,,3000,10000,3000,10000,3000,10000,3000,10000,,,,,0,1000,,,,,50,5,10,30,10,30,10,5,5,20,5,10,10,0,Never/ Rarely,Never/ Rarely,Commonly,Commonly,Commonly,Commonly,Sometimes,Never/ Rarely,Never/ Rarely,Commonly,Commonly,Commonly,Sometimes,Never/ Rarely,,,,,,,1000,10000,1000,10000,1000,10000,2000,50000,1000,10000,1000,20000,,,,,0,0,30,30,30,30,10,10,15,15,15,15,0,0,0,0,0,0,90,90,90,90,9,9,No,No,No,No,No,No,Yes,Yes,No,No,No,No,Yes,Yes,Yes,Yes,No,No,,,Commonly,Commonly,Sometimes,Sometimes,Commonly,Commonly,Commonly,Commonly,Sometimes,Sometimes,Sometimes,Sometimes,Sometimes,Sometimes,Commonly,Commonly,,,,,10,0,0,5,0,5,10,10,0,0,5,0,5,5,0,0,Never/ Rarely,Never/ Rarely,Commonly,Commonly,Commonly,Commonly,Commonly,Commonly,Never/ Rarely,Never/ Rarely,Never/ Rarely,Never/ Rarely,Commonly,Commonly,,,,,10,0,0,5,0,5,10,10,0,0,5,0,5,10,10,10,Never/ Rarely,Never/ Rarely,Commonly,Commonly,Commonly,Commonly,Never/ Rarely,Sometimes,Never/ Rarely,Commonly,Commonly,Commonly,Sometimes,Sometimes,,,,,10,10,10,10,Commonly,Commonly,Sometimes,,Commonly,Commonly,,,Commonly,Commonly,,,,,,,,,,Commonly,,,,9,No,No,No,No,No,No,No,No,No,Yes,Yes,No,Yes,No,No,Yes,No,,Most of them,Few of them,All,Yes,No,No,Yes,No,No,Yes,Yes,No,No,No,No,No,No,No,No,No,No,,The Woman Has A Right Conserning Her Health On Abortion,"The Old, It Was Illegal .The New One Illegalises But Creates A Room Under Which It Should Be Done Especially Where The Health Of The Woman Is Atrisk It Allows",It Will Help Reduce Unsafe Or Back Street Abortion(The Newone),Not Really So Far May Be 10%. Needs To Be Advocated For Alotlet Public Be Informed,Creating Public Awareness On Dangers Of Abortion And Need For People To Practice Safe Abortion If Need Be,Yes,Yes,Yes,No,Yes,No,No,,Yes,No,No,No,No,No,No,No,,Lets Have People With The Right Attitude Doing Italso Let Not Be That People Offering Pac Are The Same Peopleoffering Back Street (Unsafe )Abortion,"Inform People On Abortion Status,Unsafe Abortion And Pac Services Provisionmost People Don`T Know",16,55
78,Kibowen,31aug2012,Central & Nairobi,Nairobi/Central,Nairobi,Nairobi North,Nairobi,78,IN MATHARE AS A SALOONIST,28aug2012,Urban,10:05,Eugene/Caroline Egesa,Knows moderately well,Complete,,,Female,28,Other- Non-medical,,,10,Private sector for profit,,No,,,,,,,Yes,Yes,Yes,Yes,No,No,,No,No,No,No,No,Yes,Don't Know,Don't Know,No,No,Yes,Yes,Yes,Yes,Yes,Yes,Yes,Yes,Missing,Missing,,,Missing,Missing,,,Don't Know,Don't Know,No,No,Yes,Yes,Yes,No,Missing,Missing,,,Yes,No,Missing,Missing,,,fii. Oral introduction of drugs- Herbs/ Teas/ Solutions,hiii. Cervical/ Vaginal drugs- Catheter,"hiv.Cervical/ Vaginal drugs- Piercing objects (e.g. sticks, wires, knitting needles)",,,"hiv.Cervical/ Vaginal drugs- Piercing objects (e.g. sticks, wires, knitting needles)",fii. Oral introduction of drugs- Herbs/ Teas/ Solutions,,,,hiii. Cervical/ Vaginal drugs- Catheter,e. Medication abortion (e.g. Cytotec/misoprostol),,,,e. Medication abortion (e.g. Cytotec/misoprostol),c. Manual vacuum aspiration (MVA),,,,e. Medication abortion (e.g. Cytotec/misoprostol),hiii. Cervical/ Vaginal drugs- Catheter,,,,e. Medication abortion (e.g. Cytotec/misoprostol),c. Manual vacuum aspiration (MVA),,,,fv. Oral introduction of drugs- Other,,,,,e. Medication abortion (e.g. Cytotec/misoprostol),,,,,Sometimes,Never/ Rarely,Never/ Rarely,Commonly,Never/ Rarely,Commonly,Never/ Rarely,Commonly,Never/ Rarely,Commonly,Sometimes,Commonly,Commonly,Sometimes,,,,,500,1000,1500,2000,1500,2000,0,0,2000,3000,1800,2000,500,1000,,,,,15,5,1,20,1,20,2,30,1,25,10,0,70,0,Sometimes,Never/ Rarely,Never/ Rarely,Commonly,Never/ Rarely,Commonly,Never/ Rarely,Sometimes,Never/ Rarely,Commonly,Commonly,Commonly,Commonly,Never/ Rarely,,,,,3000,4000,4000,5000,4000,5000,6000,7000,4500,6000,4000,6000,2000,3000,,,,,30,0,5,10,10,10,5,10,0,70,20,0,30,0,10,10,5,0,98,98,100,100,5,8,No,No,No,No,No,No,No,No,No,No,No,No,Yes,Yes,Yes,Yes,No,No,,,Sometimes,Sometimes,Commonly,Commonly,Commonly,Commonly,Sometimes,Sometimes,Sometimes,Sometimes,Commonly,Commonly,Commonly,Commonly,Commonly,Commonly,,,,,6,2,2,1,1,4,8,5,2,2,0,0,3,7,3,10,Commonly,Never/ Rarely,Commonly,Commonly,Sometimes,Commonly,Never/ Rarely,Commonly,Never/ Rarely,Commonly,Never/ Rarely,Commonly,Commonly,Commonly,,,,,7,3,2,2,1,8,9,5,2,0,0,0,10,10,4,10,Sometimes,Never/ Rarely,Never/ Rarely,Commonly,Sometimes,Commonly,Commonly,Commonly,Never/ Rarely,Commonly,Commonly,Commonly,Commonly,Never/ Rarely,,,,,0,5,5,1,Commonly,Sometimes,Commonly,Commonly,Commonly,Commonly,Commonly,Never/Rarely,Commonly,Commonly,,,Commonly,Commonly,Sometimes,Commonly,Commonly,Commonly,Commonly,Commonly,Commonly,,,6,Yes,Yes,No,No,No,No,No,No,No,No,Yes,No,No,No,No,Yes,No,,Few of them,Few of them,All,Yes,Yes,No,No,Yes,No,No,No,No,No,No,No,No,No,No,No,No,No,,Abortion Is Illegal Unless It`S To Save Health Of A Woman,They All Illegalise Abortionthough The Old One Was Very Strict It Never Allowed For Thesake Of The Woman But The New One Allows When The Healthof The Woman Is At Risk,Atleast A Woman Health Was Considered At The New One Whichi Like Anyway The New Constitution Empowers A Woman Alot,It Has Because Now One Can Approach A Health Provider\Facility And Seek Advice On Abortion Issues Even Be Safely Helpedto Abort,Sensitise It To The Public Mostly Women Telling Them Good Health Is Their Right As Written In The New Constitution Evento Access Safe Abortion Is Part Of It,Yes,No,No,No,Yes,Yes,No,,Yes,No,No,No,No,Yes,No,No,,Change Of Attitude Of The Health Provider In Our Public Facilities,No Comment,10,58
79,Kibowen,31aug2012,Central & Nairobi,Nairobi/Central,Nairobi,Nairobi North,Nairobi,79,IN MATHARE AS A CASUAL WORKER,28aug2012,Urban,11:03,Eugene/Caroline Egesa,Knows very well,Complete,,,Female,29,Other- Non-medical,,,5,Private sector for profit,,No,,,,,,,No,Yes,Yes,Yes,No,Yes,,Don't Know,Don't Know,Don't Know,Don't Know,No,Yes,Don't Know,Don't Know,No,Yes,Yes,Yes,Yes,No,No,Yes,No,Yes,No,Yes,Juice Concotion,Juice Concotion,Missing,Missing,,,No,Yes,Don't Know,No,No,Yes,No,Yes,Missing,Missing,,,No,Yes,Missing,Missing,,,fii. Oral introduction of drugs- Herbs/ Teas/ Solutions,"hiv.Cervical/ Vaginal drugs- Piercing objects (e.g. sticks, wires, knitting needles)",f i. Oral introduction of drugs- Hormonal drugs (e.g. Contraceptive pills),,,"fiv. Oral introduction of drugs- Overdose of pharmaceuticals (e.g. Quinine, SP 3 tablets)",hiii. Cervical/ Vaginal drugs- Catheter,e. Medication abortion (e.g. Cytotec/misoprostol),,,e. Medication abortion (e.g. Cytotec/misoprostol),,,,,c. Manual vacuum aspiration (MVA),e. Medication abortion (e.g. Cytotec/misoprostol),,,,e. Medication abortion (e.g. Cytotec/misoprostol),,,,,c. Manual vacuum aspiration (MVA),e. Medication abortion (e.g. Cytotec/misoprostol),,,,fii. Oral introduction of drugs- Herbs/ Teas/ Solutions,,,,,fv. Oral introduction of drugs- Other,hiii. Cervical/ Vaginal drugs- Catheter,fii. Oral introduction of drugs- Herbs/ Teas/ Solutions,"fiv. Oral introduction of drugs- Overdose of pharmaceuticals (e.g. Quinine, SP 3 tablets)",,Commonly,Never/ Rarely,Never/ Rarely,Sometimes,Never/ Rarely,Commonly,Sometimes,Commonly,Never/ Rarely,Sometimes,Never/ Rarely,Sometimes,Commonly,Never/ Rarely,,,,,500,1000,1300,1500,1500,1800,1500,1800,2000,2500,1800,2000,500,800,0,0,,,18.518518,5,9.2592592,5,13.888889,15,9.2592592,10,7.4074073,45,5.5555553,15,36.111111,5,Commonly,Never/ Rarely,Sometimes,Never/ Rarely,Sometimes,Never/ Rarely,Sometimes,Never/ Rarely,Never/ Rarely,Commonly,Sometimes,Never/ Rarely,Commonly,,,,,,2000,2500,2500,2500,2700,2900,3000,3300,4000,4500,3000,3600,1500,2000,0,0,,,10,0,10,5,15,15,10,0,15,75,10,5,30,0,5,10,5,10,30,100,80,100,5,9,Yes,Yes,No,No,No,No,No,No,No,No,No,No,No,No,Yes,Yes,No,No,,,Commonly,Commonly,Commonly,Commonly,Commonly,Commonly,Commonly,Commonly,Commonly,Commonly,Commonly,Commonly,Commonly,Commonly,Commonly,Commonly,,,,,8,5,0,5,0,3,8,8,5,3,5,0,3,8,3,10,Commonly,Never/ Rarely,Sometimes,Never/ Rarely,Sometimes,Never/ Rarely,Never/ Rarely,Never/ Rarely,Never/ Rarely,Commonly,Never/ Rarely,Sometimes,Commonly,Never/ Rarely,,,,,8,5,3,4,1,3,10,8,7,5,4,1,3,10,5,10,Commonly,Never/ Rarely,Sometimes,Never/ Rarely,Sometimes,Sometimes,Sometimes,Never/ Rarely,Never/ Rarely,Commonly,Never/ Rarely,Sometimes,Commonly,Never/ Rarely,,,,,1,3,3,8,,,,,,Commonly,,,Commonly,Commonly,,,,,,Commonly,,,Commonly,,,Commonly,Increase Confidence Inourhealth Sector,8,Yes,Yes,No,No,No,No,No,No,No,Yes,Yes,No,No,No,No,Yes,No,,Most of them,Missing,All,Yes,Yes,Yes,No,Yes,Yes,No,No,No,No,No,No,No,No,No,No,No,No,,Abortion Practise Is A Criminal Offence,The Older One Allowed Abortion Practise And It Was Done Allover But The New One Prohibits Unless The Health Of The Woman Is At Risk,Let`S Have Strict Policies In Regard To Abortion Provision In Kenya,Not Influenced At All,By Allowing Hospital To Practise\Exercise Safe Abortion Asa Service To The Public,Yes,Yes,No,No,No,No,No,,No,No,No,No,No,No,No,Yes,Eliminate Quacks Who Practise Us Safe Abortion,Pac Provider To Use Good Language And Attitude Towards Pac Patientsgood Counselling That Is Patient Bassed Emmotionally And Phsycologically Acceptable,Let Government Try To Eliminate Quacks Who Offer Un Safe Abortion By Allowing Hospital To Provide Safe Abortiomn Services To The Public At An Affordable Fee With Well Equiped Facilities\Equipment,11,54
80,Kibowen,31aug2012,Central & Nairobi,Nairobi/Central,Nairobi,Nairobi North,Nairobi,80,AT MATHARE AS HAIR DRESSER,28aug2012,Urban,12:05,Eugene/Caroline Egesa,Knows moderately well,Complete,,,Female,26,Other- Non-medical,,,3,Private sector for profit,,Yes,Matuu-Kivandini,,,,,,Yes,Yes,Yes,Yes,No,Yes,,No,No,No,No,No,Yes,Don't Know,Missing,Yes,Yes,No,Yes,Yes,Yes,No,Yes,Yes,Yes,Missing,Missing,,,Missing,Missing,,,No,No,Don't Know,Don't Know,No,Don't Know,No,Yes,Missing,Missing,,,Yes,No,Missing,Missing,,,fii. Oral introduction of drugs- Herbs/ Teas/ Solutions,"hiv.Cervical/ Vaginal drugs- Piercing objects (e.g. sticks, wires, knitting needles)",,,,"hiv.Cervical/ Vaginal drugs- Piercing objects (e.g. sticks, wires, knitting needles)",fii. Oral introduction of drugs- Herbs/ Teas/ Solutions,,,,,,,,,e. Medication abortion (e.g. Cytotec/misoprostol),a. Dilation and Evacuation (D&E),b. Dilation and curettage (D&C),c. Manual vacuum aspiration (MVA),,b. Dilation and curettage (D&C),,,,,c. Manual vacuum aspiration (MVA),e. Medication abortion (e.g. Cytotec/misoprostol),,,,fiii. Oral introduction of drugs- Caustic agents (e.g. Washing detergent),"fiv. Oral introduction of drugs- Overdose of pharmaceuticals (e.g. Quinine, SP 3 tablets)",,,,e. Medication abortion (e.g. Cytotec/misoprostol),fii. Oral introduction of drugs- Herbs/ Teas/ Solutions,,,,Commonly,Never/ Rarely,Never/ Rarely,Commonly,Never/ Rarely,Commonly,Never/ Rarely,Commonly,Never/ Rarely,Commonly,Sometimes,Sometimes,Commonly,Never/ Rarely,,,,,800,1000,2000,2500,2000,2500,1000,1500,2500,3000,1000,1300,300,500,0,0,,,30.30303,5,12.121212,30,5.0505052,10,5.0505052,5,7.0707068,40,10.10101,8,30.30303,2,Commonly,Never/ Rarely,Never/ Rarely,Commonly,Never/ Rarely,Commonly,Sometimes,Sometimes,Never/ Rarely,Commonly,Commonly,Sometimes,Commonly,Never/ Rarely,,,,,1000,1500,2000,2500,2000,2500,1000,1500,2500,3000,1000,2500,300,500,0,0,,,30,5.0505052,15,30.30303,15,25.252525,5,10.10101,5,25.252525,10,2.0202019,20,2.0202019,20,50,20,50,80,80,80,80,5,8,Yes,Yes,No,No,No,No,Yes,Yes,Yes,Yes,No,No,No,No,No,No,No,No,,,Commonly,Commonly,Commonly,Commonly,Commonly,Commonly,Commonly,Commonly,Commonly,Commonly,Commonly,Commonly,Commonly,Commonly,Commonly,Commonly,,,,,8,5,5,6,2,5,8,8,6,6,5,2,5,8,8,8,Commonly,Never/ Rarely,Never/ Rarely,Sometimes,Never/ Rarely,Sometimes,Sometimes,Sometimes,Never/ Rarely,Commonly,Sometimes,Sometimes,Commonly,Never/ Rarely,,,,,8,5,5,6,2,5,8,2,5,5,5,2,5,8,8,8,Sometimes,Never/ Rarely,Commonly,Never/ Rarely,Commonly,Sometimes,Sometimes,Never/ Rarely,Never/ Rarely,Commonly,Sometimes,Sometimes,Commonly,Never/ Rarely,,,,,2,5,2,5,Commonly,Never/Rarely,Never/Rarely,Never/Rarely,Commonly,Commonly,Commonly,Never/Rarely,Commonly,Commonly,,,Commonly,,,,,,,Commonly,,,,5,Yes,Yes,Yes,No,Yes,No,No,No,No,No,Yes,No,No,No,No,Yes,No,,Few of them,Few of them,All,Yes,Sometimes,No,Yes,Yes,No,No,No,No,No,No,No,No,No,No,No,No,No,,One Depending On Her Health Status Can Be Allowed To Do Abortion. Otherwise It Is Illegal,The Older One Allowed People To Abort But The New One Has Put Condition Under Which To Abort Otherwise It`S Illegal(Abortion)On The New Constitution,The Current One That Illegalises Abortion Restricts Women From Engaging In Unprotected Sex To Avoid Getting Pregnant.Women Are Now Carefull On Their Sexual Activities,It Has Not Influenced At All Still The Law Is Unclear,Educate Women On The Dangers Of Unsafe Abortion And Teach Women To Negotiate For Safe Sexual Activities,Yes,No,No,No,No,No,No,,Yes,Yes,No,No,No,No,No,No,,Employ More Qualified Health Providersfriendly Medical Provider With Agood Attitude Towards Pac Patients,No Comment,13,7
81,Kibowen,31aug2012,Central & Nairobi,Nairobi/Central,Nairobi,Nairobi North,Nairobi,81,IN MATHARE VALLEY AS A CASUAL LABOURER\BUSINESS,28aug2012,Urban,13:18,Eugene/Caroline Egesa,Knows moderately well,Complete,,,Female,27,Other- Non-medical,,,5,Private sector for profit,,No,,,,,,,No,Yes,Yes,Yes,No,Yes,,Don't Know,Don't Know,Don't Know,Don't Know,Don't Know,Don't Know,Don't Know,Don't Know,No,Yes,Don't Know,Don't Know,Yes,No,No,No,Yes,Yes,Missing,Missing,,,Missing,Missing,,,No,No,Don't Know,Don't Know,Yes,Yes,Yes,Yes,Missing,Missing,,,Don't Know,Don't Know,Missing,Missing,,,hiii. Cervical/ Vaginal drugs- Catheter,fii. Oral introduction of drugs- Herbs/ Teas/ Solutions,,,,e. Medication abortion (e.g. Cytotec/misoprostol),,,,,e. Medication abortion (e.g. Cytotec/misoprostol),,,,,e. Medication abortion (e.g. Cytotec/misoprostol),,,,,e. Medication abortion (e.g. Cytotec/misoprostol),,,,,e. Medication abortion (e.g. Cytotec/misoprostol),,,,,"fiv. Oral introduction of drugs- Overdose of pharmaceuticals (e.g. Quinine, SP 3 tablets)",hiii. Cervical/ Vaginal drugs- Catheter,,,,"fiv. Oral introduction of drugs- Overdose of pharmaceuticals (e.g. Quinine, SP 3 tablets)",,,,,Commonly,Never/ Rarely,Never/ Rarely,Commonly,Never/ Rarely,Commonly,Commonly,Never/ Rarely,Never/ Rarely,Commonly,Sometimes,Never/ Rarely,Commonly,Never/ Rarely,,,,,500,1000,1500,2000,1500,2000,1000,1000,1500,2000,500,1000,150,200,,,,,20,10,14,22,16,13,10,10,10,20,10,17,20,8,Commonly,Never/ Rarely,Never/ Rarely,Commonly,Never/ Rarely,Commonly,Sometimes,Sometimes,Never/ Rarely,Commonly,Never/ Rarely,Never/ Rarely,Commonly,Never/ Rarely,,,,,2000,2500,4000,5000,4000,5000,4000,5000,5000,10000,,,500,700,,,,,10,5,5,15,12,20,13,10,15,40,20,10,25,0,20,20,20,20,25,25,25,25,8,8,No,No,No,No,Yes,No,No,No,No,Yes,No,No,Yes,Yes,No,No,No,No,,,Commonly,Commonly,Commonly,Commonly,Commonly,Commonly,Sometimes,Sometimes,Never/Rarely,Never/Rarely,Commonly,Commonly,Commonly,Commonly,Commonly,Commonly,,,,,5,3,3,3,1,5,8,5,3,1,4,1,6,8,5,8,Commonly,Never/ Rarely,Sometimes,Commonly,Sometimes,Commonly,Sometimes,Commonly,Never/ Rarely,Commonly,Never/ Rarely,Never/ Rarely,Commonly,Never/ Rarely,,,,,5,3,3,4,2,5,8,5,3,3,4,2,5,8,5,10,Commonly,Never/ Rarely,Sometimes,Commonly,Sometimes,Commonly,Sometimes,Sometimes,Sometimes,Commonly,Sometimes,Sometimes,Commonly,Never/ Rarely,,,,,5,7,5,8,Commonly,Commonly,Sometimes,Commonly,Commonly,Commonly,Sometimes,Commonly,Commonly,Commonly,,,Commonly,Commonly,,,,Commonly,Commonly,,,,,6,Yes,Yes,No,Yes,Yes,No,No,Yes,No,No,Yes,No,No,No,No,Yes,No,,None of them,Missing,All,Yes,Yes,No,Yes,Yes,No,No,No,No,No,No,No,No,No,No,No,No,No,,Abortion Is A Crime,I Did Not Know What The Old Used To State But The New Statesif The Woman Health Is At Risk One Can Be Allowed To Aborton Health Grounds,I Don`T Know,Now Less People Are Engaging In Abortion Act Because Of Thestrict Laws And Follow Up Done By Government,Government To Improve On It`S Citizen Livehood I.E By Creating Jobs And Employing The Many Jobless Youths,Yes,No,No,No,No,No,No,,No,No,No,No,No,Yes,Yes,Yes,Eliminate Quacks,Health Provider To Have Right Attitude While Handling Pac Patients,No Comment,14,37
82,Kibowen,31aug2012,Central & Nairobi,Nairobi/Central,Nairobi,Nairobi North,Nairobi,82,IN HURUMA AS A BUSINESS WOMAN,28aug2012,Urban,14:52,Eugene/Caroline Egesa,Knows moderately well,Complete,,,Female,31,Other- Non-medical,,,2,Private sector for profit,,No,,,,,,,No,Yes,Yes,Yes,No,No,,Don't Know,Don't Know,Don't Know,Don't Know,No,No,Don't Know,Don't Know,No,No,Yes,Yes,Yes,Yes,No,No,No,Yes,Missing,Missing,,,Missing,Missing,,,Don't Know,Don't Know,Don't Know,Don't Know,No,Yes,No,No,Missing,Missing,,,Yes,Don't Know,Missing,Missing,,,fii. Oral introduction of drugs- Herbs/ Teas/ Solutions,,,,,e. Medication abortion (e.g. Cytotec/misoprostol),,,,,e. Medication abortion (e.g. Cytotec/misoprostol),hiii. Cervical/ Vaginal drugs- Catheter,,,,e. Medication abortion (e.g. Cytotec/misoprostol),hiii. Cervical/ Vaginal drugs- Catheter,,,,e. Medication abortion (e.g. Cytotec/misoprostol),,,,,c. Manual vacuum aspiration (MVA),,,,,f i. Oral introduction of drugs- Hormonal drugs (e.g. Contraceptive pills),,,,,f i. Oral introduction of drugs- Hormonal drugs (e.g. Contraceptive pills),,,,,Sometimes,Never/ Rarely,Never/ Rarely,Commonly,Never/ Rarely,Sometimes,Never/ Rarely,Never/ Rarely,Never/ Rarely,Commonly,Never/ Rarely,Never/ Rarely,Commonly,Never/ Rarely,,,,,500,700,1000,1500,1000,1500,,,5000,6000,,,1,300,,,,,15,0,20,20,25,20,25,15,10,35,5,10,0,0,Commonly,Never/ Rarely,Commonly,Never/ Rarely,Commonly,Sometimes,Commonly,Never/ Rarely,Never/ Rarely,Commonly,Commonly,Commonly,Commonly,Never/ Rarely,,,,,1000,1000,2000,2500,2000,2500,2000,2500,7000,10000,1000,1000,1,500,,,,,0,0,20,15,30,20,15,20,10,30,25,15,0,0,30,0,60,0,90,100,90,100,5,10,No,No,No,No,No,No,No,No,No,No,No,No,Yes,Yes,No,No,No,No,,,Commonly,Commonly,Commonly,Commonly,Commonly,Commonly,Commonly,Commonly,Never/Rarely,Never/Rarely,Sometimes,Sometimes,Commonly,Commonly,Commonly,Commonly,,,,,3,6,6,4,1,8,10,,3,2,3,0,10,10,4,10,Commonly,Never/ Rarely,Never/ Rarely,Commonly,Never/ Rarely,Commonly,Sometimes,Never/ Rarely,Never/ Rarely,Commonly,Never/ Rarely,Commonly,Commonly,Never/ Rarely,,,,,2,5,6,4,2,3,,,4,3,4,0,3,,6,10,Never/ Rarely,Never/ Rarely,Commonly,Commonly,Commonly,Commonly,Never/ Rarely,Never/ Rarely,Sometimes,Commonly,Commonly,Commonly,Never/ Rarely,Never/ Rarely,,,,,6,10,3,10,Commonly,Commonly,Commonly,Commonly,Commonly,Commonly,Commonly,Never/Rarely,Commonly,Commonly,,,,,,Commonly,,,Commonly,Commonly,,,,6,Yes,Yes,No,Yes,Yes,Yes,No,No,No,Yes,Yes,No,No,No,No,No,No,,None of them,Missing,All,Yes,Sometimes,Yes,No,No,No,No,No,No,No,No,No,Yes,No,No,No,No,No,,Never Readi Don`T Know,I Don`T Know,N\R,I Don`T Know,I Wiil Read What It Says First Then I Will Understand And Make A Comment,Yes,No,No,No,No,No,No,,Yes,Yes,No,No,No,No,Yes,Yes,Legalise Abortion Like In U.S.A,Attitude Change Of Especially Public Health Providersmore Counselling To Pac Patients,"People Made Aware Of The Abortion And It`S Risklet It Be Advocated The Way Tb,Hiv\Aids,Breast Feeding Has Beensensitised",16,0
