4,Kibowen,03sep2012,Eastern,Other regions,Eastern,Machakos,Machakos,4,MACHAKOS EASTERN PROVINCE,25jun2012,Urban,12:00,Ann Ngugi,Knows very well,Complete,,,Male,,OB-GYN,,,15,Public sector (Govt),,Yes,Malindi,Machakos Rural,,,,,Yes,Yes,No,No,No,No,,Missing,Yes,Missing,Yes,Missing,Yes,Missing,Missing,Yes,Yes,Missing,Missing,Yes,Yes,Yes,Yes,Yes,Yes,Missing,Missing,,,Missing,Missing,,,Missing,Missing,Missing,Missing,Missing,Missing,Yes,Missing,Missing,Missing,,,Yes,Missing,Missing,Missing,,,"hiv.Cervical/ Vaginal drugs- Piercing objects (e.g. sticks, wires, knitting needles)",hii. Cervical/ Vaginal drugs- Herbs/Teas/ Solutions (Using form of insertion),,,,,,,,,e. Medication abortion (e.g. Cytotec/misoprostol),c. Manual vacuum aspiration (MVA),,,,,,,,,,,,,,e. Medication abortion (e.g. Cytotec/misoprostol),c. Manual vacuum aspiration (MVA),,,,"hiv.Cervical/ Vaginal drugs- Piercing objects (e.g. sticks, wires, knitting needles)",e. Medication abortion (e.g. Cytotec/misoprostol),,,,b. Dilation and curettage (D&C),,,,,Commonly,Sometimes,Sometimes,Commonly,Sometimes,Commonly,Sometimes,Commonly,Sometimes,Sometimes,Sometimes,Sometimes,Sometimes,Sometimes,Sometimes,Sometimes,,,1000,3000,1000,3000,1000,3000,1000,3000,3000,6000,1000,1000,0,0,0,0,,,,,,,,,,,,,,,,,Sometimes,Sometimes,Sometimes,Commonly,Sometimes,Commonly,Sometimes,Commonly,Never/ Rarely,Commonly,Sometimes,Commonly,Sometimes,Sometimes,,,,,500,2000,1000,6000,1000,6000,1000,6000,3000,10000,3000,5000,0,0,0,0,,,50,5,8.333333,5,16.666666,10,16.666666,20,4.1666665,30,4.1666665,20,0,10,30,10,40,10,90,90,90,90,2,2,No,No,Yes,Yes,Yes,No,No,No,Yes,Yes,Yes,No,No,No,Yes,No,No,No,,,Commonly,Commonly,Commonly,Commonly,Commonly,Commonly,Sometimes,Sometimes,Sometimes,Sometimes,Sometimes,Sometimes,Sometimes,Sometimes,Sometimes,Sometimes,Sometimes,Sometimes,,,6,3,3,3,1,2,8,6,3,3,3,1,2,8,3,10,Sometimes,,Commonly,Sometimes,Sometimes,Sometimes,Sometimes,Sometimes,Sometimes,Commonly,Sometimes,Sometimes,Sometimes,Sometimes,,,,,6,3,3,3,1,3,8,6,3,3,3,1,3,8,6,10,Sometimes,Sometimes,Commonly,Sometimes,Commonly,Sometimes,Commonly,Sometimes,Sometimes,Sometimes,Sometimes,Sometimes,Sometimes,Sometimes,,Sometimes,,,7,9,8,10,,Sometimes,Commonly,Never/Rarely,Sometimes,Sometimes,Sometimes,Never/Rarely,Commonly,Commonly,Commonly,Missing,,Sometimes,Sometimes,Sometimes,Sometimes,Commonly,Sometimes,Sometimes,Sometimes,Sometimes,,9,Yes,No,No,Yes,Yes,Yes,No,No,No,No,Yes,No,Yes,Yes,No,Yes,No,,Most of them,Most of them,All,Yes,Yes,Yes,Yes,Yes,No,Yes,Yes,Yes,Yes,No,No,No,No,No,No,No,No,,Abortion Not Permitted Unless In The View Of A Trained Health Provider The Health Of The Mother Is In Danger,Not Included In The Old Constitutionmore Stringent In The New One,Confirming Limiting Care,It Is Not In Practice,Prove Safe Reproductive Health Care,Yes,No,No,No,No,No,No,,Yes,Yes,Yes,Yes,Yes,No,No,No,,Privacypain Managementmale Counselingavail Contraceptives,Start Reproductive Health Education At Upper Primary And Secondary Levelprovide Contraceptives To Teenegers,14,0
5,Kibowen,03sep2012,Rift valley,Other regions,Rift Valley,Trans Nzoia West,Trans Nzoia,5,MILELE FM RADIO STATION,27jun2012,Urban,15:30,Ann Ngugi,Knows very well,Incomplete,,,Female,30,Other- Non-medical,,,7,Private sector for profit,,Yes,Pokot,Cherengany,Kwanza,Saboti,Eldoret,,No,Yes,No,Yes,No,No,,Don't Know,No,No,Yes,Don't Know,Yes,Yes,Yes,Yes,Yes,No,No,Yes,Yes,Yes,No,Yes,Yes,Missing,Missing,,,Don't Know,Missing,,,No,Don't Know,Yes,No,No,Don't Know,No,No,Missing,Missing,,,Don't Know,No,Missing,Missing,,,fii. Oral introduction of drugs- Herbs/ Teas/ Solutions,,,,,a. Dilation and Evacuation (D&E),b. Dilation and curettage (D&C),c. Manual vacuum aspiration (MVA),d. Electric vacuum aspiration (EVA),e. Medication abortion (e.g. Cytotec/misoprostol),f i. Oral introduction of drugs- Hormonal drugs (e.g. Contraceptive pills),c. Manual vacuum aspiration (MVA),,,,c. Manual vacuum aspiration (MVA),b. Dilation and curettage (D&C),e. Medication abortion (e.g. Cytotec/misoprostol),,,a. Dilation and Evacuation (D&E),b. Dilation and curettage (D&C),c. Manual vacuum aspiration (MVA),d. Electric vacuum aspiration (EVA),,a. Dilation and Evacuation (D&E),b. Dilation and curettage (D&C),c. Manual vacuum aspiration (MVA),d. Electric vacuum aspiration (EVA),,,,,,,,,,,,Commonly,Never/ Rarely,Commonly,Sometimes,Sometimes,Commonly,Never/ Rarely,Never/ Rarely,Never/ Rarely,Commonly,Never/ Rarely,Sometimes,Commonly,Never/ Rarely,,,,,100,300,1500,2000,1500,2000,500,700,2500,3000,500,800,200,300,0,0,,,100,,0,,0,,0,,0,,0,,0,,,,,,,,,,,,,,,,,,,,0,0,0,0,0,0,0,0,0,0,0,0,0,0,0,0,,,,,,,,,,,,,,,,,,,,,,,,,,,,,,,,,,,,,,,,,,,,,,,,,,,,,,,,,,,,,,,,,,,,,,,,,,,,,,,,,,,,,,,,,,,,,,,,,,,,,,,,,,,,,,,,,,,,,,,,,,,,,,,,,,,,,,,,,,,,,,,,,,,,,,,,,,,,,,,,,,,No,No,No,No,No,No,No,Missing,Missing,Missing,Missing,No,No,No,Yes,Missing,No,,Missing,Missing,Missing,Missing,Missing,No,No,No,Missing,No,No,No,Missing,Missing,Missing,Missing,No,No,No,No,No,,,,,,,No,No,No,No,No,No,No,,Missing,Missing,Missing,Missing,Missing,Missing,Missing,Missing,,,,5,30
6,Kibowen,03sep2012,Rift valley,Other regions,Rift Valley,Trans Nzoia West,Trans Nzoia,6,HANDICAP INTERNATIONAL,28jun2012,Rural,08:39,Ann Ngugi,Knows very well,Complete,,,Female,36,Counselor/ Social Worker,,,10,Private sector not-for profit,,Yes,Kitale,Pokot,Mt. Elgon,,,,No,No,Yes,No,No,No,,No,Yes,No,Missing,Yes,Missing,No,Missing,Yes,Missing,Missing,Missing,Yes,Missing,Missing,Missing,Missing,Missing,Missing,Missing,,,Don't Know,Missing,,,Don't Know,Missing,Don't Know,Missing,Don't Know,Missing,Don't Know,Missing,Missing,Missing,,,No,Missing,Missing,Missing,,,fii. Oral introduction of drugs- Herbs/ Teas/ Solutions,,,,,,,,,,a. Dilation and Evacuation (D&E),,,,,,,,,,a. Dilation and Evacuation (D&E),,,,,,,,,,e. Medication abortion (e.g. Cytotec/misoprostol),,,,,,,,,,Commonly,,Commonly,,Commonly,,Sometimes,,Sometimes,,Never/ Rarely,,Sometimes,,,,,,2000,4000,3000,5000,3000,5000,7000,10000,7000,12000,0,0,500,1500,0,0,,,16.32653,,12.244898,,20.408163,,20.408163,,24.489796,,2.0408163,,4.0816326,,,,,,,,,,,,,,,,,,,,0,0,0,0,0,0,0,0,0,0,0,0,0,0,0,0,,,,,,,,,,,,,,,,,30,15,,,50,60,,,8,,No,No,Yes,Yes,Yes,Yes,Yes,Yes,Yes,Yes,Yes,Yes,Yes,Yes,Yes,Yes,No,No,,,Sometimes,,Commonly,,Commonly,,Sometimes,,Sometimes,,Sometimes,,Sometimes,,Commonly,,,,,,6,2,3,2,0,0,8,,,,,,,,8,5,Commonly,,Sometimes,,Sometimes,,Commonly,,Never/ Rarely,,,,Commonly,,,,,,,,,,,,,,,,,,,,,,,,,,,,,,,,,,,,,,,,5,,8,,,Commonly,Commonly,Sometimes,Sometimes,Commonly,Commonly,Commonly,Commonly,Commonly,,,,Commonly,Commonly,Commonly,Commonly,Commonly,Commonly,Commonly,Commonly,,,7,Yes,Yes,No,Yes,No,Yes,No,No,No,Yes,No,No,No,Yes,No,Yes,No,,Few of them,Few of them,All,Yes,Yes,No,No,No,Yes,No,No,No,No,No,No,No,No,No,No,No,No,,"Abortion Is Not Permitted Unless In The Opinion Of A Trainedhealth Proffessional, There Is Need For Emergency Treatmentor The Life Of The Mother Is In Danger Or If Permitted By Any Other Law","The Difference Is In The Old Constitution, Abortion Was Notpermitted No Matter The Circumstances  Around It. But With The New Constitution, There Is That Flexibility",For Me There Are Necessary Given The Fact That They Are Notbeing Done Intentionally,I Haven`T Come Accrose Any Case Lately But I Think Other Women Are Benefiting From These,By Putting Punitive Clause That Wouldbring Into Accountability The People Who Are Doing It Intentionally,Yes,Yes,No,Yes,Yes,Yes,No,,Yes,No,Yes,Yes,Yes,Yes,No,No,,Men Involment In The Pac Services And Client Friendly Services That Involve Dialogue&Counselling,Kindly Lets Lobby For More Liberal Laws On Pac That Would Not Glorify Abortionin Our Country But Also Put The Interest Of The Victims In Consideration,9,29
7,Kibowen,03sep2012,Rift valley,Other regions,Rift Valley,Trans Nzoia West,Trans Nzoia,7,KITALE DISTRICT HOSPITAL,28jun2012,Urban,10:20,Ann Ngugi,Knows very well,Complete,,,Female,47,Nurse,,,22,Public sector (Govt),,No,,,,,,,Yes,No,No,Yes,No,No,,No,Yes,No,Yes,Yes,Yes,No,Yes,Yes,Yes,Yes,Yes,Yes,Yes,Yes,Yes,Yes,Yes,Missing,Missing,,,Yes,Yes,,,Yes,Yes,Yes,Yes,Yes,Yes,Yes,Yes,Yes,Yes,,,Yes,Yes,Missing,Missing,,,fii. Oral introduction of drugs- Herbs/ Teas/ Solutions,fiii. Oral introduction of drugs- Caustic agents (e.g. Washing detergent),,,,fii. Oral introduction of drugs- Herbs/ Teas/ Solutions,fiii. Oral introduction of drugs- Caustic agents (e.g. Washing detergent),"hiv.Cervical/ Vaginal drugs- Piercing objects (e.g. sticks, wires, knitting needles)",,,c. Manual vacuum aspiration (MVA),e. Medication abortion (e.g. Cytotec/misoprostol),hiii. Cervical/ Vaginal drugs- Catheter,,,c. Manual vacuum aspiration (MVA),e. Medication abortion (e.g. Cytotec/misoprostol),hiii. Cervical/ Vaginal drugs- Catheter,b. Dilation and curettage (D&C),,c. Manual vacuum aspiration (MVA),e. Medication abortion (e.g. Cytotec/misoprostol),hiii. Cervical/ Vaginal drugs- Catheter,,,a. Dilation and Evacuation (D&E),b. Dilation and curettage (D&C),c. Manual vacuum aspiration (MVA),d. Electric vacuum aspiration (EVA),hiii. Cervical/ Vaginal drugs- Catheter,,,,,,,,,,,Commonly,Commonly,Sometimes,Sometimes,Sometimes,Commonly,Sometimes,Sometimes,Never/ Rarely,Commonly,Never/ Rarely,Never/ Rarely,Commonly,Commonly,,,,,500,1000,2000,3000,1500,2500,2000,3000,3000,10000,0,0,0,0,0,0,,,34,22,10,10,8,20,3,8,5,10,0,0,40,30,Sometimes,Never/ Rarely,Sometimes,Commonly,Sometimes,Sometimes,Sometimes,Sometimes,Sometimes,Commonly,Never/ Rarely,Never/ Rarely,Commonly,Sometimes,,,,,1000,2000,2000,3000,2000,3000,2000,3000,5000,10000,3000,10000,0,0,0,0,,,19,5,10,20,10,15,10,15,23,30,3,5,25,10,10,30,15,30,80,80,85,93,2,5,No,No,Yes,No,Yes,Yes,Yes,No,No,Yes,Yes,Yes,Yes,Yes,Yes,Yes,No,No,,,Commonly,Commonly,Commonly,Commonly,Commonly,Commonly,Commonly,Sometimes,Sometimes,Never/Rarely,Sometimes,Sometimes,Sometimes,Sometimes,Commonly,Commonly,Never/Rarely,Never/Rarely,,,4,1,1,1,1,1,4,4,1,1,1,1,1,4,7,9,Never/ Rarely,Never/ Rarely,Sometimes,Commonly,Sometimes,Sometimes,Commonly,Sometimes,Commonly,Commonly,Never/ Rarely,Never/ Rarely,Sometimes,Sometimes,Sometimes,Never/ Rarely,Chws,Chws,5,1,2,2,1,0,4,1,1,1,1,0,0,2,5,9,Never/ Rarely,Never/ Rarely,Sometimes,Commonly,Sometimes,Sometimes,Sometimes,Sometimes,Commonly,Commonly,Never/ Rarely,Never/ Rarely,Never/ Rarely,Never/ Rarely,,,,,2,6,3,7,Commonly,Sometimes,Never/Rarely,Sometimes,Commonly,Sometimes,Sometimes,Sometimes,Commonly,Sometimes,,,Never/Rarely,Never/Rarely,Sometimes,Never/Rarely,Never/Rarely,Never/Rarely,Sometimes,Sometimes,Never/Rarely,,,7,Yes,No,No,Yes,Yes,No,Yes,No,No,Yes,Yes,No,Yes,No,No,Yes,No,,Few of them,Most of them,All,Yes,Yes,Yes,Yes,Yes,Yes,Yes,Yes,Yes,Yes,Yes,No,Yes,Yes,No,No,No,No,,Every Person Has A Right To Lifelife Starts At Conception. A Person Shall Not Be Deprived Oflife Intentionallyabortion Is Not Permitted Unless In The Opinion Of A Trainedhealth Professional Or The Life The Mother Is In Danger,The New Constitution Reffers To Any Trained Health Proffesional While The Old Reffered To Doctors Or Medical Ptractitioners,These Changes Are Dangerous Because Not All Trained Health Professionals Deal With Reproductive Health Human Beings As They Don`T Understand The Analogy And Physiology Ofreproductive Health,These Constitution Will Influence The Increase Of Abortionssince Any One In The Hospitalset Can Request For Abortion,"Change The Clause Of Any Trained Professional To Specific Professionals That Is Doctors, Clinical Officers And Nurses\Midwife",Yes,No,No,No,Yes,No,No,,Yes,Yes,Yes,Yes,Yes,Yes,No,No,,Pac Services Should Be Available In Both Rural And Urban Setups And Capacity Build All Health Service Providers On Pacthe Service Delivery Points Should Also Be Easily Accesibleand The Cost Should Be Affordableall The Roads To Health Facilities,"Abortion Constitution Should Never Be Taken Advantage Of Bythe Kenyansi Would Request That May Opinion To Be Taken Seriously To Improve The Health Facilities More Also Employ The Skilled Personellwhen Pac Services Are Implemented, Abortion Risk",12,59
8,Kibowen,03sep2012,Rift valley,Other regions,Rift Valley,Trans Nzoia West,Trans Nzoia,8,K24 TELEVISION STATION,27jun2012,Urban,15:30,Ann Ngugi,Knows very well,Complete,,,Male,28,Other- Non-medical,,,2,Private sector for profit,,Yes,Kachibora,Kwanza,Cherananyi,Kiminini,,,Yes,Yes,Yes,Yes,No,No,,Yes,Don't Know,No,Yes,No,Yes,No,Yes,Yes,Yes,Yes,Yes,Yes,No,No,No,Yes,No,Don't Know,Don't Know,,,Don't Know,Don't Know,,,No,Yes,Yes,No,No,No,No,No,Don't Know,Don't Know,,,No,No,Don't Know,Don't Know,,,fii. Oral introduction of drugs- Herbs/ Teas/ Solutions,,,,,fii. Oral introduction of drugs- Herbs/ Teas/ Solutions,,,,,fii. Oral introduction of drugs- Herbs/ Teas/ Solutions,,,,,f i. Oral introduction of drugs- Hormonal drugs (e.g. Contraceptive pills),,,,,f i. Oral introduction of drugs- Hormonal drugs (e.g. Contraceptive pills),,,,,c. Manual vacuum aspiration (MVA),hi. Cervical/ Vaginal drugs-Hormonal drugs (e.g. Contraceptives),,,,"fiv. Oral introduction of drugs- Overdose of pharmaceuticals (e.g. Quinine, SP 3 tablets)",,,,,"fiv. Oral introduction of drugs- Overdose of pharmaceuticals (e.g. Quinine, SP 3 tablets)",,,,,Commonly,Sometimes,Never/ Rarely,Sometimes,Never/ Rarely,Sometimes,Sometimes,Commonly,Sometimes,Commonly,Sometimes,Commonly,Sometimes,Never/ Rarely,,,,,500,1500,3000,5000,3000,7000,500,1500,7000,10000,500,5000,0,1000,0,0,,,40,5,10,20,10,10,15,5,5,50,10,7,10,3,Commonly,Never/ Rarely,Sometimes,Commonly,Sometimes,Commonly,Sometimes,Sometimes,Sometimes,Commonly,Sometimes,Commonly,Sometimes,Sometimes,,,,,500,2000,3000,7000,1500,5000,1000,3000,3000,7000,3000,8000,0,1000,0,0,,,55,10,10,10,10,10,20,5,3,50,1,10,1,5,30,50,40,70,60,90,70,90,6,3,Yes,No,Yes,No,Yes,Yes,Yes,Yes,No,Yes,No,Yes,No,No,No,No,No,No,,,Commonly,Sometimes,Commonly,Never/Rarely,Commonly,Sometimes,Sometimes,Never/Rarely,Commonly,Never/Rarely,Commonly,,Commonly,Never/Rarely,Sometimes,Sometimes,,Sometimes,,,5,3,3,7,2,3,7,5,2,2,5,1,3,5,2,6,Sometimes,Never/ Rarely,Sometimes,Commonly,Sometimes,Sometimes,Never/ Rarely,Never/ Rarely,Sometimes,Commonly,Sometimes,Sometimes,Never/ Rarely,Never/ Rarely,,,,,5,3,3,7,1,4,8,8,2,4,7,0,3,4,3,9,Sometimes,Never/ Rarely,Sometimes,Sometimes,Sometimes,Sometimes,Sometimes,Never/ Rarely,Sometimes,Commonly,Sometimes,Sometimes,Never/ Rarely,Never/ Rarely,,,,,6,9,6,8,,Sometimes,Sometimes,Sometimes,Sometimes,Never/Rarely,Sometimes,Never/Rarely,Sometimes,Commonly,,,,Commonly,Commonly,Commonly,Commonly,Commonly,Commonly,Commonly,Commonly,,,8,Yes,No,No,No,Yes,Yes,No,No,No,No,Yes,No,No,No,No,No,No,,Few of them,None of them,All,Yes,Yes,No,No,No,No,No,No,No,Yes,Yes,No,No,Yes,No,Yes,No,Yes,Counselling,It`S Illegal,Old Does Not Allow Abortionnew Legalises Only On Certain Circumstances,The Changes Should Be Maintained,Has Increased Rate Of Abortion,Increasing Funds To Providers So That Women Who Want To Perform Abortion Can Get The Service At No Costservice Providers Be Motivated,Yes,Yes,No,No,Yes,No,Yes,If Mother Can`T Carry Pregnancy Due To Physical Impairement,Yes,Yes,Yes,No,Yes,No,No,No,,Caring Attitude From Service Providerscompetence To Avoid Deathsmotivation For Service Providers By The Government,"The Doctor Or Clinical Officer After Performing An Abortionfor Rape ,Risk Health Or School Child, They Should Be Givensome Allowance So That They Are Committed To Perform The Duty To Avoid Deaths",5,30
9,Kibowen,04sep2012,Rift valley,Other regions,Rift Valley,Trans Nzoia West,Trans Nzoia,9,NATION MEDIA GROUP,27jun2012,Urban,15:30,Ann Ngugi,Knows very well,Complete,,,Male,28,Other- Non-medical,,,2,Private sector for profit,,Yes,Kachibora,Kwanza,Kiminini,,,,Yes,Yes,Yes,Yes,No,No,,Yes,Don't Know,No,Yes,No,Yes,No,Yes,Yes,Yes,Yes,Yes,Yes,No,Yes,No,Don't Know,No,Don't Know,Missing,,,Missing,Don't Know,,,Yes,Missing,Missing,Yes,Missing,No,Missing,No,No,No,,,Missing,Missing,Don't Know,Don't Know,,,fii. Oral introduction of drugs- Herbs/ Teas/ Solutions,,,,,"hiv.Cervical/ Vaginal drugs- Piercing objects (e.g. sticks, wires, knitting needles)",,,,,fii. Oral introduction of drugs- Herbs/ Teas/ Solutions,,,,,b. Dilation and curettage (D&C),,,,,d. Electric vacuum aspiration (EVA),,,,,d. Electric vacuum aspiration (EVA),,,,,"hiv.Cervical/ Vaginal drugs- Piercing objects (e.g. sticks, wires, knitting needles)",,,,,,,,,,Commonly,Sometimes,,Sometimes,Never/ Rarely,Commonly,Sometimes,Commonly,Sometimes,Commonly,Sometimes,,Sometimes,Never/ Rarely,Sometimes,,,,500,500,300,500,300,600,500,1500,700,5200,1000,1000,0,0,0,0,,,40,4.9019608,10,9.8039217,10,29.411764,15,49.019608,5,6.8627453,10,0,10,0,Sometimes,,,,,,,,,,,,,,,,,,500,700,4000,7000,3000,4000,2000,2500,4000,5000,3000,4000,0,0,0,0,,,8.695652,.24937657,8.695652,14.962593,8.695652,14.962593,13.043478,17.45636,8.695652,24.937656,8.695652,12.468828,43.47826,14.962593,90,30,10,90,25,75,75,25,3,10,No,No,Yes,No,Yes,No,Yes,No,No,Yes,Yes,Yes,Yes,No,Yes,No,No,No,,,Commonly,,Commonly,Commonly,,Commonly,,Commonly,Commonly,,,,Commonly,Commonly,Commonly,Commonly,,,,,,,,,,,,,,,,,,,3,10,,,,,,,,,,,,,,,,,,,,,,,,,,,,,,,,,10,,,,,,,,,,,,,,,,,,,,10,10,10,10,,,,,,,,,,,,,,,,,,,,,,,,,No,No,No,No,No,No,No,No,No,Yes,No,No,No,No,No,No,No,,Few of them,None of them,All,Yes,Yes,No,No,No,No,No,No,No,No,Yes,No,No,No,No,Yes,No,No,,,,,,,Yes,Yes,No,No,Yes,Yes,No,,No,Yes,No,No,No,No,No,No,,,,17,30
10,Kibowen,04sep2012,Rift valley,Other regions,Rift Valley,Trans Nzoia West,Trans Nzoia,10,KITALE DISTRICT HOSPITAL,28jun2012,Urban,14:30,Ann Ngugi,Knows very well,Complete,,,Female,46,Nurse,,,18,Public sector (Govt),,No,,,,,,,No,No,Yes,No,No,No,,No,No,No,Yes,No,Yes,Don't Know,Don't Know,Yes,Yes,Yes,Yes,Yes,Yes,Yes,Yes,Yes,Yes,Missing,Missing,,,Missing,Missing,,,Don't Know,Don't Know,Yes,Yes,Missing,Yes,Yes,Missing,Missing,Missing,,,Yes,No,Missing,Missing,,,fii. Oral introduction of drugs- Herbs/ Teas/ Solutions,"hiv.Cervical/ Vaginal drugs- Piercing objects (e.g. sticks, wires, knitting needles)",,,,"fiv. Oral introduction of drugs- Overdose of pharmaceuticals (e.g. Quinine, SP 3 tablets)",,,,,"fiv. Oral introduction of drugs- Overdose of pharmaceuticals (e.g. Quinine, SP 3 tablets)",,,,,fiii. Oral introduction of drugs- Caustic agents (e.g. Washing detergent),c. Manual vacuum aspiration (MVA),,,,,,,,,b. Dilation and curettage (D&C),,,,,"hiv.Cervical/ Vaginal drugs- Piercing objects (e.g. sticks, wires, knitting needles)",,,,,fiii. Oral introduction of drugs- Caustic agents (e.g. Washing detergent),,,,,Never/ Rarely,Never/ Rarely,Sometimes,Sometimes,Never/ Rarely,Never/ Rarely,Sometimes,Sometimes,Commonly,Commonly,Commonly,Commonly,Sometimes,Commonly,,,,,300,600,5000,6000,1000,3000,2000,5000,10000,20000,10000,20000,0,0,0,0,,,1.2820513,.99009901,25.641026,37.623764,1.2820513,1.980198,1.2820513,1.980198,32.051281,54.455444,12.820513,1.980198,25.641026,.99009901,Sometimes,Never/ Rarely,Sometimes,Sometimes,Sometimes,Sometimes,Sometimes,Sometimes,Commonly,Commonly,Never/ Rarely,Never/ Rarely,Sometimes,Sometimes,,,,,500,1000,5000,10000,3000,5000,3000,5000,10000,20000,8000,8000,1000,1000,0,0,,,10,10,10,5,5,5,5,5,60,50,0,10,10,15,10,20,10,20,80,90,90,98,8,4,Yes,No,Yes,No,Yes,No,No,Yes,No,Yes,Yes,Yes,Yes,Yes,Yes,No,No,No,,,Commonly,Commonly,Commonly,Commonly,Commonly,Commonly,Commonly,Sometimes,Commonly,Sometimes,Commonly,Commonly,Sometimes,Sometimes,Commonly,Commonly,,,,,8,4,5,5,2,6,9,7,3,3,2,1,4,8,5,4,Commonly,Never/ Rarely,Sometimes,,Sometimes,,Sometimes,,Commonly,,Sometimes,,Never/ Rarely,,,,,,6,4,4,4,2,1,6,6,3,4,3,1,1,5,5,8,Never/ Rarely,Never/ Rarely,Sometimes,Commonly,Sometimes,Sometimes,Sometimes,Sometimes,Sometimes,Commonly,Never/ Rarely,Never/ Rarely,Never/ Rarely,Sometimes,,,,,5,9,4,9,,Sometimes,Sometimes,Never/Rarely,Sometimes,Sometimes,Commonly,Sometimes,Sometimes,Sometimes,,,Never/Rarely,Commonly,Commonly,Sometimes,Never/Rarely,Never/Rarely,Never/Rarely,Never/Rarely,Never/Rarely,,,9,No,No,No,Yes,Yes,No,No,No,No,Yes,No,No,No,No,No,Yes,No,,Most of them,Few of them,All,Yes,Yes,Yes,No,Yes,No,Yes,Yes,No,No,No,No,No,No,No,No,No,No,,Life Begins At Conception And That Termination Of Pregnancycan Only Be Done By Any Health Proffessional And Only When The Life Of The Mother Is In Danger,In The New Constitution Only Health Professionalcan Terminate Pregnancy Not Just A Doctor,"There Is A Gap In These Changesany Health Professional Can Be A Lab Tech,Pharmacist,Dentist,Nurses E.T.C. This Should Have Been Left Only To The Gynaccologist",Anyone Working In The Hospital In The Name Of `A Health Professional` Can Offer Abortion Services .This Is Bound To Abuse And Likely To Course More Complicationsour Women Are Still Not Safe,The Law Should Be Very Clear On Who Can Prescribe And Carryout An Abortion,Yes,No,No,No,No,No,No,,Yes,Yes,Yes,Yes,Yes,No,No,No,,Pac Services Should Be Available Every Where (Any Public Hospital)Including Dispensaries And Health Centresfamily Planning (Post Abortion)Be A Mustcapacity Build All If Not Most Health Care Providers In Pac,Thank You For This Good Work,17,0
11,Kibowen,04sep2012,Rift valley,Other regions,Rift Valley,Trans Nzoia West,Trans Nzoia,11,KITALE DISTRICT HOSPITAL,29jun2012,Urban,09:00,Ann Ngugi,Knows moderately well,Complete,,,Male,32,Medical Officer/GP,,,5,Public sector (Govt),,No,,,,,,,Yes,No,No,Yes,No,No,,No,Yes,No,Yes,Yes,Yes,No,No,Yes,Yes,No,No,Yes,Yes,No,No,No,No,Missing,Missing,,,No,No,,,No,No,Yes,Yes,No,No,Yes,Yes,Missing,Missing,,,Yes,Yes,Missing,Missing,,,fii. Oral introduction of drugs- Herbs/ Teas/ Solutions,,,,,fii. Oral introduction of drugs- Herbs/ Teas/ Solutions,,,,,e. Medication abortion (e.g. Cytotec/misoprostol),,,,,e. Medication abortion (e.g. Cytotec/misoprostol),,,,,e. Medication abortion (e.g. Cytotec/misoprostol),,,,,e. Medication abortion (e.g. Cytotec/misoprostol),,,,,fii. Oral introduction of drugs- Herbs/ Teas/ Solutions,,,,,e. Medication abortion (e.g. Cytotec/misoprostol),,,,,Commonly,Never/ Rarely,Sometimes,Sometimes,Sometimes,Sometimes,Sometimes,Sometimes,Never/ Rarely,Commonly,Sometimes,Sometimes,Sometimes,Never/ Rarely,,,,,500,1000,1000,3000,1000,2000,1000,2000,1000,5000,500,1000,0,0,0,0,,,50,0,10,20,10,10,10,10,0,50,10,10,10,0,Sometimes,Never/ Rarely,Commonly,Sometimes,Sometimes,Never/ Rarely,Sometimes,Never/ Rarely,Never/ Rarely,Commonly,Sometimes,Never/ Rarely,Sometimes,Never/ Rarely,,,,,500,1000,1000,3000,1000,2000,1000,2000,1000,5000,500,1000,0,0,0,0,,,10,0,40,10,10,0,10,0,0,90,10,0,20,0,40,70,50,95,20,50,30,90,2,3,No,No,Yes,Yes,Yes,No,No,No,No,Yes,Yes,Yes,No,No,Yes,Yes,No,No,,,Commonly,Commonly,Commonly,Commonly,Commonly,Commonly,Sometimes,Sometimes,Sometimes,Sometimes,Sometimes,Sometimes,Sometimes,Sometimes,Sometimes,Sometimes,,,,,6,3,4,4,1,5,7,6,2,3,3,0,5,6,6,10,Commonly,Sometimes,Sometimes,Commonly,Sometimes,Commonly,Sometimes,Commonly,Never/ Rarely,Commonly,Sometimes,Sometimes,Never/ Rarely,Never/ Rarely,,,,,5,2,3,3,1,5,6,5,1,2,2,0,5,5,7,10,Commonly,Never/ Rarely,Sometimes,Sometimes,Sometimes,Never/ Rarely,Sometimes,Never/ Rarely,Never/ Rarely,Commonly,Sometimes,Never/ Rarely,Never/ Rarely,Never/ Rarely,,,,,5,6,7,8,Commonly,Sometimes,Sometimes,Sometimes,Commonly,Commonly,Commonly,Sometimes,Commonly,Sometimes,,,Commonly,Sometimes,Sometimes,Commonly,Sometimes,Commonly,Commonly,Sometimes,Sometimes,,,8,No,No,No,No,No,No,No,No,No,Yes,Yes,No,No,No,No,No,No,,Few of them,Few of them,All,Yes,Yes,Yes,Yes,No,Yes,Yes,No,No,No,No,No,No,No,No,No,No,No,,"Abortion Is Permitted When In The Opinion Of A Qualified Health Provider,It Is Necessary So As To Safeguard The Physicalmental Or Psychological Well Being Of The Mother","The Old Constitution Permitted Abortion Only When The Mother`S Life Was At Risk Whereas The New Constitution Permits Abortion Wherew It Is Necessary To Safeguard Her Health . I,E N",I Think They Are Appropriate Because They Could Potentiallyreduce The Prevallence Of Abortion By Allowing More Women Toseek Safe Abortion,"It Has Allowed More Women To Seek Safe Abortion . However ,This Has Not Been Realised In Rural And Low Socio-Economic Communities Due To Lack Of Information","Promoting Safe Abortion Services In The Health Facilities Ataffordable Rates .At The Same Time ,Promote Responsible Sexual Behaviour And Contraceptive Use",Yes,Yes,No,Yes,Yes,Yes,Yes,Feotus With Congenital Malformation,Yes,Yes,Yes,Yes,Yes,No,No,No,,More Adolescent Friendlymore Widely Available Especially In Rural Areasmore Affordable,"In Order To Reduce Morbidity(Mortality Due To Unsafe Abortion)Train More Health Workers Onpac\Saccivic Education On Abortion Law, Contraceptive Use And Safesex",11,0
