28,Patrick,04sep2012,Central & Nairobi,Nairobi/Central,Nairobi,Missing,Nairobi,28,MISSING .,27jul2012,Urban,,Prof. Lawrence Ikamari,Knows very well,Complete,,,Male,,OB-GYN,,,22,Public sector (Govt),,No,,,,,,,Yes,Yes,No,Yes,No,No,,Yes,Yes,Yes,Yes,Yes,Yes,Missing,Missing,Yes,Yes,Missing,Missing,Yes,Yes,Yes,Yes,Yes,Yes,Missing,Missing,,,Missing,Missing,,,Missing,Missing,Yes,Yes,Yes,Yes,Yes,Yes,Missing,Missing,,,Missing,Missing,Missing,Missing,,,fii. Oral introduction of drugs- Herbs/ Teas/ Solutions,,,,,fii. Oral introduction of drugs- Herbs/ Teas/ Solutions,,,,,a. Dilation and Evacuation (D&E),c. Manual vacuum aspiration (MVA),,,,a. Dilation and Evacuation (D&E),c. Manual vacuum aspiration (MVA),,,,a. Dilation and Evacuation (D&E),b. Dilation and curettage (D&C),,,,a. Dilation and Evacuation (D&E),b. Dilation and curettage (D&C),,,,hii. Cervical/ Vaginal drugs- Herbs/Teas/ Solutions (Using form of insertion),,,,,hii. Cervical/ Vaginal drugs- Herbs/Teas/ Solutions (Using form of insertion),,,,,Commonly,Sometimes,Sometimes,Sometimes,Sometimes,Sometimes,Sometimes,Commonly,Never/ Rarely,Commonly,Never/ Rarely,Sometimes,Sometimes,Sometimes,,,,,1500,4000,4000,8000,3000,6000,4000,10000,5000,15000,1500,3000,,,,,,,47.619049,30,19.047619,25,9.5238094,5,14.285714,20,.95238096,10,1.9047619,5,6.6666665,5,Commonly,Commonly,Sometimes,Sometimes,Sometimes,Sometimes,Sometimes,Sometimes,Sometimes,Commonly,Sometimes,Commonly,Sometimes,Sometimes,,,,,3000,4000,5000,10000,4000,8000,6000,14000,10000,50000,3000,5000,,,,,,,20,10,30,25,10,15,10,20,10,25,0,2,20,3,,,5,5,,,5,5,,,Yes,Yes,Yes,Yes,Yes,Yes,No,No,Yes,Yes,Yes,Yes,Yes,Yes,Yes,Yes,No,No,,,Sometimes,Sometimes,Sometimes,Sometimes,Sometimes,Sometimes,Sometimes,Sometimes,Never/Rarely,Never/Rarely,Never/Rarely,Never/Rarely,Sometimes,Sometimes,Commonly,Commonly,,,,,10,8,9,8,5,9,10,10,8,9,8,5,9,10,6,8,Commonly,Never/ Rarely,Sometimes,Sometimes,Sometimes,Sometimes,Sometimes,Commonly,Never/ Rarely,Commonly,Never/ Rarely,Sometimes,Sometimes,Sometimes,,,,,10,8,9,8,5,9,10,10,8,9,8,5,9,10,6,8,Sometimes,Never/ Rarely,Sometimes,Commonly,Sometimes,Commonly,Sometimes,Commonly,Never/ Rarely,Commonly,Never/ Rarely,Sometimes,Sometimes,Sometimes,,,,,6,8,7,9,Commonly,Sometimes,Never/Rarely,Never/Rarely,Sometimes,Commonly,Commonly,Sometimes,Sometimes,Commonly,,,,Never/Rarely,Never/Rarely,Never/Rarely,Never/Rarely,Never/Rarely,Never/Rarely,Never/Rarely,Never/Rarely,Never/Rarely,,8,No,No,No,No,No,No,No,No,No,Yes,Yes,No,No,No,No,Yes,No,,Most of them,Most of them,All,Yes,Sometimes,No,Yes,Yes,No,No,Yes,No,No,No,No,No,No,No,No,No,No,,Abortion Is Illegal.It Can Only Be Given Legally If The Health Of The Woman Is In Danger.,More Health Professional Can Now Provide It If In Their Viewthe Health Of A Woman Is In Danger.,"They Are In The Right Direction Since There Is Many Doctorsin This Coutry ,Particularly In Rural Areas.",Not Much.,Not Sure.,Yes,No,No,No,Yes,Yes,No,,Yes,Yes,Yes,Yes,Yes,No,No,No,,Make Them Easily Accessible And Affordable.,Abortion Issue Should Be Handled With Alot Of Care.Familiescan Be Destroyed If Abortion Will Be Legalized.,Missing,Missing
27,Patrick,04sep2012,Central & Nairobi,Nairobi/Central,Nairobi,Missing,Nairobi,27,MISSING.,29jul2012,Urban,,Prof. Lawrence Ikamari,Knows very well,Complete,,,Female,43,Medical Officer/GP,,,16,Public sector (Govt),,No,,,,,,,Yes,No,No,Yes,No,No,,Yes,Yes,Yes,Yes,Yes,Yes,Missing,Missing,Yes,Yes,Missing,Missing,Yes,Yes,Yes,Yes,Yes,Yes,Missing,Missing,,,Missing,Missing,,,Missing,Missing,Yes,Yes,Yes,Yes,Missing,Missing,Missing,Missing,,,Missing,Missing,Missing,Missing,,,fii. Oral introduction of drugs- Herbs/ Teas/ Solutions,,,,,fii. Oral introduction of drugs- Herbs/ Teas/ Solutions,,,,,a. Dilation and Evacuation (D&E),c. Manual vacuum aspiration (MVA),,,,a. Dilation and Evacuation (D&E),c. Manual vacuum aspiration (MVA),,,,a. Dilation and Evacuation (D&E),b. Dilation and curettage (D&C),,,,a. Dilation and Evacuation (D&E),b. Dilation and curettage (D&C),,,,hii. Cervical/ Vaginal drugs- Herbs/Teas/ Solutions (Using form of insertion),,,,,hii. Cervical/ Vaginal drugs- Herbs/Teas/ Solutions (Using form of insertion),,,,,Commonly,Never/ Rarely,Sometimes,Sometimes,Sometimes,Sometimes,Sometimes,Sometimes,Never/ Rarely,Commonly,Never/ Rarely,Sometimes,Sometimes,Sometimes,,,,,1500,3000,3000,6000,2000,7000,3000,6000,5000,25000,3000,6000,,,,,,,40,20,30,40,5,10,5,10,5,10,5,5,10,5,Commonly,Never/ Rarely,Sometimes,Sometimes,Sometimes,Sometimes,Sometimes,Sometimes,Sometimes,Commonly,Sometimes,Sometimes,Sometimes,,,,,,2000,4000,5000,15000,3000,,5000,20000,10000,50000,2000,4000,,,,,,,10,5,10,20,10,20,15,20,20,30,10,5,25,0,,,5,5,,,5,5,,7,Yes,Yes,Yes,Yes,Yes,Yes,Yes,Yes,Yes,Yes,Yes,Yes,Yes,Yes,Yes,Yes,No,No,,,Commonly,Commonly,Sometimes,Sometimes,Sometimes,Sometimes,Sometimes,Sometimes,Never/Rarely,Never/Rarely,Never/Rarely,Never/Rarely,Sometimes,Sometimes,Commonly,Commonly,,,,,10,8,9,8,5,9,10,10,8,9,8,5,9,10,4,7,Commonly,Commonly,Sometimes,Sometimes,Sometimes,Sometimes,Sometimes,Sometimes,Sometimes,Sometimes,Never/ Rarely,Sometimes,Sometimes,,,,,,10,8,9,8,5,9,10,10,8,9,8,5,9,10,6,9,Commonly,Never/ Rarely,Sometimes,Sometimes,Sometimes,Sometimes,Sometimes,Sometimes,Never/ Rarely,Commonly,Sometimes,Sometimes,Sometimes,,,,,,5,6,6,9,Commonly,Sometimes,Sometimes,Sometimes,Sometimes,Sometimes,Sometimes,Sometimes,Sometimes,Sometimes,,,,Never/Rarely,Never/Rarely,Never/Rarely,Never/Rarely,Never/Rarely,Never/Rarely,Never/Rarely,Sometimes,,,8,No,No,No,No,No,No,No,No,No,Yes,No,Yes,No,No,No,Yes,No,,Most of them,Most of them,All,Yes,No,No,Yes,Yes,No,No,No,No,No,No,No,No,No,No,No,No,No,,Abortion Is Illegal And Can Only Be Given If The Health Of The Woman Is At Risk.,More Health Providers Can Provide It.,They Are Positive.,Not Much Because Abortion Is A Very Emotive Issue.,Not Sure.,Yes,No,No,No,Yes,Yes,No,,Yes,Yes,Yes,Yes,Yes,No,No,No,,Increase The Number Of Outlets And Restrain Providers Clientrelationship.,No.,Missing,Missing
25,Patrick,04sep2012,Central & Nairobi,Nairobi/Central,Nairobi,Missing,Nairobi,25,MISSING .,14may2012,Urban,09:20,Prof. Lawrence Ikamari,Knows moderately well,Complete,,,Female,44,Researcher,,,12,Public sector (Govt),,No,,,,,,,No,No,Yes,No,No,No,,Don't Know,Don't Know,Don't Know,Don't Know,Don't Know,Don't Know,Don't Know,Don't Know,Don't Know,Don't Know,Don't Know,Missing,Yes,Yes,Missing,Yes,Yes,Yes,Missing,Missing,,,Missing,Missing,,,Don't Know,Don't Know,Don't Know,Don't Know,Missing,Don't Know,Don't Know,Don't Know,Missing,Missing,,,Don't Know,Don't Know,Missing,Missing,,,fii. Oral introduction of drugs- Herbs/ Teas/ Solutions,,,,,fii. Oral introduction of drugs- Herbs/ Teas/ Solutions,,,,,,,,,,,,,,,,,,,,,,,,,,,,,,,,,,,Commonly,Sometimes,Never/ Rarely,Commonly,Sometimes,Commonly,Sometimes,Commonly,Sometimes,Commonly,Sometimes,Sometimes,Commonly,Sometimes,,,,,,,,,,,,,,,,,,,,,,,20,20,0,10,0,0,0,0,0,30,0,0,80,40,Commonly,Never/ Rarely,Sometimes,Sometimes,Never/ Rarely,Sometimes,Never/ Rarely,Commonly,Never/ Rarely,Commonly,Never/ Rarely,Commonly,Commonly,Sometimes,,,,,,,,,,,,,,,,,,,,,,,50,0,0,50,0,0,0,0,0,40,0,5,50,5,,,30,40,,,20,50,,4,Yes,Yes,Yes,No,Yes,Yes,No,No,No,Yes,No,Yes,No,No,No,Yes,No,No,,,Commonly,Commonly,Commonly,Commonly,Sometimes,Commonly,Sometimes,Sometimes,,Commonly,Sometimes,Commonly,Sometimes,Commonly,Commonly,Commonly,,,,,5,3,3,4,3,5,8,5,3,3,4,3,3,8,4,6,Sometimes,Never/ Rarely,Sometimes,Commonly,Sometimes,Commonly,Commonly,Sometimes,Never/ Rarely,Commonly,Sometimes,Commonly,Sometimes,Sometimes,,,,,6,7,5,8,4,6,8,4,3,4,7,3,5,6,5,8,Commonly,Never/ Rarely,Sometimes,Commonly,Sometimes,Commonly,Sometimes,Commonly,Never/ Rarely,Commonly,Sometimes,Sometimes,Sometimes,Commonly,,,,,4,8,4,8,Commonly,Commonly,Sometimes,Commonly,Commonly,Commonly,Sometimes,Commonly,Commonly,Commonly,,,,Never/Rarely,Never/Rarely,Never/Rarely,Never/Rarely,Never/Rarely,Never/Rarely,Never/Rarely,,,,6,Yes,No,No,Yes,No,No,No,No,No,Yes,No,No,No,No,No,No,No,,Most of them,Few of them,All,Yes,No,No,Yes,No,No,No,No,No,No,No,No,No,No,No,No,No,No,,Abortion Is Illegal.,New Constitution:Life Begins At Conception.Old Constitution:Life Begins At Birth.,New Constitution Allows For The Use Of Abortion By A Skilledhealth Provider In Case The Life Of The Mother Is In Dangerduring Pregnancy.,Abortion Is Illegal.However If The Life Of A Mother Is In Danger It Can Be Performed By A Skilled Health Providers.,Create More Awareness Among Girls And Women.,Yes,No,No,No,No,No,No,,Yes,Yes,Yes,Yes,Yes,Yes,No,No,,Improve Access To Health Care For Women And Girls.Provide Counselling Services.,No.,11,0
26,Patrick,04sep2012,Central & Nairobi,Nairobi/Central,Nairobi,Missing,Nairobi,26,MISSING.,24may2012,Urban,04:15,Prof. Lawrence Ikamari,Knows moderately well,Complete,,,Female,43,Missing,,,21,Public sector (Govt),,No,,,,,,,No,No,No,Yes,No,No,,Don't Know,Yes,Don't Know,Don't Know,Don't Know,Don't Know,Don't Know,Don't Know,Don't Know,Missing,Don't Know,Don't Know,Yes,Yes,Yes,Yes,Yes,Yes,Don't Know,Missing,,,Missing,Missing,,,Yes,Yes,Yes,Yes,Yes,Yes,Yes,Yes,Missing,Missing,,,Don't Know,Don't Know,Missing,Missing,,,fii. Oral introduction of drugs- Herbs/ Teas/ Solutions,,,,,fii. Oral introduction of drugs- Herbs/ Teas/ Solutions,,,,,a. Dilation and Evacuation (D&E),,,,,a. Dilation and Evacuation (D&E),,,,,a. Dilation and Evacuation (D&E),,,,,a. Dilation and Evacuation (D&E),,,,,hii. Cervical/ Vaginal drugs- Herbs/Teas/ Solutions (Using form of insertion),,,,,hii. Cervical/ Vaginal drugs- Herbs/Teas/ Solutions (Using form of insertion),,,,,Commonly,Sometimes,Sometimes,Commonly,Sometimes,Commonly,Commonly,Commonly,Sometimes,Sometimes,Sometimes,Sometimes,Commonly,Commonly,,,,,,,,,,,,,,,,,,,,,,,,,,,,,,,,,,,,,Sometimes,Commonly,Sometimes,Commonly,Sometimes,Commonly,Commonly,Commonly,Commonly,Commonly,,Sometimes,Commonly,Commonly,,,,,,,,,,,,,,,,,,,,,,,,,,,,,,,,,,,,,,,0,0,,,0,0,,6,No,No,No,No,No,No,No,No,No,No,No,No,No,No,Yes,Yes,No,No,,,Commonly,Commonly,Commonly,Commonly,Commonly,Commonly,Sometimes,Commonly,Never/Rarely,Sometimes,Sometimes,Sometimes,Commonly,Commonly,Commonly,Commonly,,,,,9,8,7,7,7,9,10,9,8,7,7,7,9,10,3,5,Commonly,Never/ Rarely,Never/ Rarely,Sometimes,Sometimes,Sometimes,Sometimes,Sometimes,Never/ Rarely,Sometimes,Sometimes,Sometimes,Sometimes,Commonly,,,,,9,,9,9,9,9,9,9,9,9,9,9,9,9,3,5,Commonly,Sometimes,Commonly,Commonly,Sometimes,Sometimes,Sometimes,Commonly,Never/ Rarely,Commonly,Commonly,Commonly,,Sometimes,,,,,4,4,4,4,,Commonly,Never/Rarely,Never/Rarely,Never/Rarely,Commonly,Sometimes,Commonly,Commonly,Sometimes,,,,Never/Rarely,Never/Rarely,Never/Rarely,Never/Rarely,Never/Rarely,,Commonly,,,,6,Yes,No,No,No,Yes,No,No,No,No,No,Yes,No,No,No,No,No,No,,Few of them,Few of them,Some,Yes,Yes,No,No,No,No,No,No,No,No,No,No,No,No,No,No,No,Yes,Not Sure.,Has Not Been Legalised.,Widen The Variety Of Providers.Life Starts At Conception As Oppossed At Birth In The Old Constitution.,These Changes Are Increasing Access To Abortion Services Towomen Whose Lives Are In Danger.,By Increasing The Number Of Health Providers Who Can Provideit.,Family Planning Should Be Strengthened And Contraceptives Should Be Made Available.,Yes,No,No,No,Yes,Yes,No,,Yes,Yes,Yes,No,No,No,No,No,,Create More Awareness And Encourage The Use Of Effective Contraceptives.,None.,5,30
58,Patrick,04sep2012,Central & Nairobi,Nairobi/Central,Nairobi,Nairobi West,Nairobi,58,UON.,08jun2012,Urban,10:15,Dr. Jedelsa Guyo,Knows very well,Complete,,,Female,43,OB-GYN,,,10,Private sector not-for profit,,No,,,,,,,Yes,No,No,No,No,No,,Missing,Yes,Missing,No,Missing,Yes,Missing,Yes,Missing,Yes,Missing,Yes,Missing,Missing,Missing,Missing,Missing,Missing,Missing,Missing,,,Missing,Missing,,,Missing,Yes,Missing,Missing,Missing,Yes,Missing,Missing,Missing,Missing,,,Missing,Missing,Missing,Missing,,,,,,,,,,,,,,,,,,,,,,,,,,,,,,,,,,,,,,,,,,,Commonly,Never/ Rarely,Never/ Rarely,Commonly,Never/ Rarely,Commonly,Never/ Rarely,Sometimes,Never/ Rarely,Sometimes,Never/ Rarely,Sometimes,Commonly,Commonly,,,,,,,,,,,,,500,2000,,,,,,,,,40,0,0,7.6923075,5,23.076923,0,15.384615,0,3.8461537,20,30.76923,35,19.23077,Commonly,Never/ Rarely,Never/ Rarely,Commonly,Never/ Rarely,Commonly,Never/ Rarely,Sometimes,Never/ Rarely,Sometimes,Never/ Rarely,Sometimes,Commonly,Commonly,,,,,,,,,,,,,1000,10000,,,,,,,,,30,0,5,10,20,20,30,10,0,20,10,40,5,0,,,,,,,,,,,,,,,,,,,,,,,,,,,,,,,Sometimes,Commonly,Commonly,Commonly,Sometimes,Commonly,Commonly,Commonly,Commonly,Commonly,Commonly,Commonly,Sometimes,Commonly,Never/Rarely,Commonly,,,,,5,1,1,1,0,1,5,5,1,1,1,0,1,5,3,8,Never/ Rarely,Never/ Rarely,Commonly,Sometimes,Commonly,Commonly,Commonly,Commonly,Sometimes,Commonly,Sometimes,Sometimes,Never/ Rarely,Never/ Rarely,,,,,5,2,2,2,,2,0,,2,2,2,0,2,,2,10,Never/ Rarely,Never/ Rarely,Sometimes,Sometimes,Sometimes,Sometimes,Sometimes,Sometimes,Never/ Rarely,Commonly,Never/ Rarely,Sometimes,Never/ Rarely,Never/ Rarely,,,,,5,10,7,10,Commonly,Commonly,Never/Rarely,Never/Rarely,Never/Rarely,Commonly,Commonly,Commonly,Commonly,Commonly,,,Never/Rarely,Never/Rarely,Never/Rarely,Never/Rarely,Never/Rarely,Never/Rarely,Never/Rarely,Never/Rarely,Never/Rarely,,,10,Yes,No,No,No,Yes,Yes,Yes,No,No,Yes,Yes,Yes,Yes,No,No,Yes,No,,Most of them,Most of them,All,Yes,Yes,Yes,Yes,Yes,Yes,Yes,Yes,No,Yes,Yes,No,No,No,No,No,No,No,,Abortion Is Not Permitted Unless In The Opinion Of A Healthcare Provider The Health/Life Of A Mother Is At Risk Or Inemergency Treatment Is Needed Or As Provider An Any Other Written Law.,Expanded Legal Provisions For Safe Abortion In New Constitution.,Wonderful For Kenyan Women.,Yes Policy Changes Underway.Middle Level Providers Trainingunderway.,Disseminate The Abortion Gains To All Providers And To Theend Users.,Yes,Yes,Yes,Yes,Yes,Yes,No,,Yes,Yes,Yes,Yes,Yes,Yes,No,No,,Should Be Made Available In All Levels Of Health Care Including Faith Based Who Currently Do Not Offer Fp Services.,This Questionnaire Is Too Long With Irrelevant  Areas And Too Much Repetition.,Missing,Missing
59,Patrick,04sep2012,Central & Nairobi,Nairobi/Central,Nairobi,Nairobi West,Nairobi,59,KNH.,05jun2012,Urban,,Dr. Jedelsa Guyo,Knows very well,Complete,,Well Performed.,Female,38,Midwife,,,14,Public sector (Govt),,No,,,,,,,Yes,No,No,No,No,No,,No,Yes,Yes,Yes,Yes,Yes,No,Yes,No,Yes,No,Don't Know,Missing,Yes,Yes,No,Yes,No,Missing,Missing,,,Missing,Missing,,,No,Don't Know,No,No,No,Yes,Yes,Yes,Missing,Missing,,,Yes,Missing,Missing,Missing,,,j. Other means,,,,,j. Other means,,,,,c. Manual vacuum aspiration (MVA),,,,,c. Manual vacuum aspiration (MVA),,,,,j. Other means,,,,,b. Dilation and curettage (D&C),,,,,hii. Cervical/ Vaginal drugs- Herbs/Teas/ Solutions (Using form of insertion),,,,,e. Medication abortion (e.g. Cytotec/misoprostol),,,,,Commonly,Sometimes,Sometimes,Commonly,Sometimes,Commonly,Sometimes,Commonly,Never/ Rarely,Commonly,Never/ Rarely,Commonly,Commonly,Never/ Rarely,,,,,1000,5000,8000,10000,5000,10000,5000,10000,5000,10000,2000,5000,1000,3000,,,,,10,10,10,10,10,10,10,10,0,50,0,0,60,10,Commonly,Never/ Rarely,Sometimes,Sometimes,Sometimes,Sometimes,Sometimes,Sometimes,Never/ Rarely,Commonly,Sometimes,Commonly,Commonly,Sometimes,,,,,,,10000,15000,10000,15000,10000,15000,15000,20000,5000,10000,,,,,,,50,10,10,10,10,10,10,10,10,50,0,10,10,0,40,70,40,70,70,80,70,80,10,5,Yes,No,No,No,No,No,No,No,No,No,No,Yes,No,No,No,No,No,No,,,Commonly,Sometimes,Commonly,Never/Rarely,Sometimes,Never/Rarely,Sometimes,Never/Rarely,Sometimes,Never/Rarely,Sometimes,Never/Rarely,Sometimes,Never/Rarely,Sometimes,Never/Rarely,,,,,7,5,5,5,3,0,7,7,5,5,5,3,,7,2,8,Never/ Rarely,Never/ Rarely,Commonly,Commonly,Commonly,Commonly,Commonly,Commonly,Commonly,Commonly,Sometimes,Sometimes,Never/ Rarely,Never/ Rarely,,,,,0,7,7,7,7,5,0,0,7,7,7,7,5,,5,10,Commonly,Never/ Rarely,Sometimes,Sometimes,Sometimes,Sometimes,Sometimes,Sometimes,Never/ Rarely,Commonly,Sometimes,Sometimes,Never/ Rarely,Never/ Rarely,,,,,2,9,2,9,,Commonly,Never/Rarely,Never/Rarely,Never/Rarely,Never/Rarely,Never/Rarely,Sometimes,Commonly,Commonly,,,Sometimes,Sometimes,Never/Rarely,Never/Rarely,Never/Rarely,Never/Rarely,Never/Rarely,Never/Rarely,Never/Rarely,,,10,Yes,No,No,No,No,No,No,No,No,Yes,No,No,No,Yes,No,No,No,,Most of them,Most of them,All,Yes,Yes,Yes,No,No,No,Yes,No,No,No,No,No,No,No,No,No,No,No,,"Not Yet Legal,Unless Performed By A Doctor For Medical Problem.",Old-Not Legal.New-Should Be Legalised.,Good.It Prevent Complication Of Unsafe Abortion.,No Change.,Education Of The Public.,Yes,Yes,No,No,Yes,Yes,No,,Yes,Yes,Yes,No,No,No,No,No,,Provide Fp Instantly.,Train Health Providers Continuosly.,Missing,Missing
60,Patrick,04sep2012,Central & Nairobi,Nairobi/Central,Nairobi,Nairobi West,Nairobi,60,KNH.,05jul2012,Urban,10:20,Dr. Jedelsa Guyo,Knows very well,Complete,,,Female,50,Nurse,,,30,Public sector (Govt),,No,,,,,,,Yes,No,No,No,No,No,,Missing,Yes,Yes,Yes,Yes,Yes,Missing,Yes,Missing,Yes,Missing,Missing,Missing,Yes,Yes,Yes,Missing,Missing,Missing,Missing,,,Missing,Missing,,,Missing,Missing,Yes,Missing,Missing,Yes,Missing,Missing,Missing,Missing,,,Missing,Missing,Missing,Missing,,,hiii. Cervical/ Vaginal drugs- Catheter,fii. Oral introduction of drugs- Herbs/ Teas/ Solutions,,,,"hiv.Cervical/ Vaginal drugs- Piercing objects (e.g. sticks, wires, knitting needles)",,,,,c. Manual vacuum aspiration (MVA),,,,,c. Manual vacuum aspiration (MVA),,,,,e. Medication abortion (e.g. Cytotec/misoprostol),c. Manual vacuum aspiration (MVA),,,,e. Medication abortion (e.g. Cytotec/misoprostol),c. Manual vacuum aspiration (MVA),,,,fiii. Oral introduction of drugs- Caustic agents (e.g. Washing detergent),,,,,fiii. Oral introduction of drugs- Caustic agents (e.g. Washing detergent),e. Medication abortion (e.g. Cytotec/misoprostol),,,,Never/ Rarely,Never/ Rarely,Never/ Rarely,Never/ Rarely,Never/ Rarely,Never/ Rarely,Never/ Rarely,Never/ Rarely,Never/ Rarely,Never/ Rarely,Never/ Rarely,Never/ Rarely,Never/ Rarely,Never/ Rarely,Never/ Rarely,Never/ Rarely,,,200,500,500,1000,500,1000,500,1000,2000,3000,,,,,,,,,9.090909,0,13.636364,20,27.272728,30,27.272728,30,9.090909,20,4.5454545,0,9.090909,0,Commonly,Never/ Rarely,Sometimes,Never/ Rarely,Commonly,Sometimes,Commonly,Sometimes,Never/ Rarely,Commonly,Never/ Rarely,Sometimes,Never/ Rarely,Sometimes,Never/ Rarely,Sometimes,,,500,1000,1000,2000,1000,2000,1000,2000,5000,10000,,,,,,,,,20,5.5555553,10,11.111111,10,22.222221,20,22.222221,0,22.222221,20,11.111111,20,5.5555553,80,80,80,80,95,95,95,95,6,6,No,No,Yes,No,No,No,No,No,No,No,No,Yes,Yes,No,No,Yes,No,No,,,Commonly,Commonly,Commonly,Commonly,Commonly,Commonly,Commonly,,Sometimes,Never/Rarely,Never/Rarely,Never/Rarely,Never/Rarely,Never/Rarely,Commonly,Commonly,,,,,10,5,5,5,0,0,10,10,5,5,5,0,,10,3,5,Commonly,Never/ Rarely,Sometimes,Sometimes,Sometimes,Sometimes,Sometimes,Sometimes,Never/ Rarely,Commonly,Never/ Rarely,Sometimes,Never/ Rarely,Never/ Rarely,,,,,10,5,5,5,,0,5,10,5,5,5,0,0,5,10,10,Commonly,Never/ Rarely,Sometimes,Sometimes,Sometimes,Sometimes,Sometimes,Sometimes,Never/ Rarely,Commonly,Never/ Rarely,Commonly,Commonly,Never/ Rarely,,,,,2,5,5,8,,Never/Rarely,Never/Rarely,Never/Rarely,Sometimes,Commonly,Commonly,Never/Rarely,Commonly,Commonly,,,Never/Rarely,Sometimes,Never/Rarely,Sometimes,Sometimes,Sometimes,Sometimes,Commonly,,Commonly,Stigma.,10,Yes,Yes,No,No,No,No,No,No,No,Yes,No,No,No,No,No,Yes,No,,Most of them,Few of them,All,Yes,Yes,No,No,No,Yes,No,No,No,No,No,No,No,No,No,No,No,No,,Not Allowed.,Added Reproductive Health Article.,Mother Given More Rights On Reproductive/Sexual Health.,I Don'T Think The Grassroot Women Has Any Idea.,Through Civic Education.,Yes,No,No,No,Yes,No,Yes,Rape On Mentally Handicaped.,No,Yes,No,No,No,No,No,Yes,Involve The Church To Couselling.,Every Woman Needs To Leave The Ward With A Long Term Method.,Remove The Extremist  In The Abortion Debate.,11,50
61,Patrick,04sep2012,Central & Nairobi,Nairobi/Central,Nairobi,Nairobi West,Nairobi,61,R.H.S.,16jul2012,Urban,08:55,Dr. Jedelsa Guyo,Knows very well,Complete,,,Male,56,OB-GYN,,,17,Private sector for profit,,No,,,,,,,No,Yes,No,No,No,No,,No,Yes,Don't Know,Yes,Yes,Yes,Don't Know,Yes,Yes,Yes,Yes,No,Yes,No,Don't Know,No,Yes,No,Don't Know,No,Missng.,,Don't Know,No,,,No,No,No,No,Yes,No,Yes,No,Missing,Missing,,,No,No,Missing,Missing,,,fii. Oral introduction of drugs- Herbs/ Teas/ Solutions,,,,,,,,,,e. Medication abortion (e.g. Cytotec/misoprostol),,,,,e. Medication abortion (e.g. Cytotec/misoprostol),,,,,e. Medication abortion (e.g. Cytotec/misoprostol),c. Manual vacuum aspiration (MVA),,,,e. Medication abortion (e.g. Cytotec/misoprostol),c. Manual vacuum aspiration (MVA),,,,e. Medication abortion (e.g. Cytotec/misoprostol),,,,,e. Medication abortion (e.g. Cytotec/misoprostol),,,,,Commonly,Never/ Rarely,Sometimes,Sometimes,Commonly,Commonly,Commonly,Commonly,Never/ Rarely,Sometimes,Sometimes,Sometimes,Sometimes,Sometimes,,,,,2000,3000,3000,5000,1000,3000,3000,4000,3000,5000,2000,4000,500,1000,,,,,20,5,20,20,30,10,10,20,10,30,5,10,5,5,Sometimes,Never/ Rarely,Sometimes,Commonly,Sometimes,Commonly,Sometimes,Sometimes,Never/ Rarely,Commonly,Never/ Rarely,Sometimes,Sometimes,Never/ Rarely,,,,,1000,2000,2000,4000,3000,5000,3000,5000,5000,10000,2000,3000,500,1000,,,,,40,5,20,20,20,10,8,20,2,20,5,20,5,5,30,80,50,95,98,99,99,99,2,1,No,No,No,No,Yes,Yes,No,No,No,No,No,No,Yes,No,Yes,No,No,No,,,Commonly,Sometimes,Sometimes,Sometimes,Sometimes,Sometimes,Sometimes,Never/Rarely,Sometimes,Never/Rarely,Sometimes,Never/Rarely,Sometimes,Never/Rarely,Commonly,Commonly,,,,,7,4,5,5,1,4,8,7,4,5,5,1,4,8,5,8,Sometimes,Never/ Rarely,Sometimes,Sometimes,Sometimes,Commonly,Sometimes,Commonly,Commonly,Commonly,Sometimes,Never/ Rarely,Sometimes,Never/ Rarely,,,,,8,4,3,3,1,4,6,8,4,3,3,1,4,6,8,10,Sometimes,Never/ Rarely,Sometimes,Sometimes,Sometimes,Sometimes,Sometimes,Sometimes,Sometimes,Commonly,Sometimes,Never/ Rarely,Never/ Rarely,Never/ Rarely,,,,,2,10,3,10,,Commonly,Commonly,Sometimes,Sometimes,Never/Rarely,Sometimes,Sometimes,Commonly,Commonly,,,Commonly,Commonly,Commonly,Commonly,Commonly,Commonly,Commonly,Commonly,Commonly,,,9,Yes,No,No,No,Yes,No,No,No,No,Yes,Yes,No,Yes,No,No,Yes,No,,Few of them,Few of them,All,Yes,Yes,Yes,Yes,Yes,Yes,Yes,Yes,No,No,No,No,No,No,Yes,No,No,No,,"Abortion Is Not Provided Except,In The Opinion Of A Trainedhealth Professional There Is Need For Emergency,To Save Thelife Of The Mother,The Health Of The Mother Or As Provided In Any Other Written Law.",The Old Constitution Was Restrictive To Allow Termination Ofpregnancy Only To Save The Mother'S Life Is In Danger.,They Are Positive.,Slowly Improving The Situation But Implementation Of The Constitution Is Slow.,To Develop Clinical Standards And Guidelines By The Ministryof Health Before Full Implementation Of The Constitution.,Yes,Yes,No,Yes,Yes,Yes,Yes,Congenital Fetal Malformation.,Yes,Yes,Yes,Yes,Yes,Yes,No,No,,All The 5 Elements Should Be Implemented Effectively.,No.,Missing,Missing
96,Patrick,04sep2012,Central & Nairobi,Nairobi/Central,Nairobi,Nairobi East,Nairobi,96,IN MARINGO AS PHARM TECH RUNNING A CHEMIST BUSINES,31aug2012,Urban,15:05,Eugene/Caroline Egesa,Knows moderately well,Complete,,,Male,28,Other-Medical,,,3,Private sector for profit,,No,,,,,,,No,Yes,Yes,Yes,No,Yes,,No,No,No,No,No,No,Yes,Don't Know,No,No,Yes,No,Yes,No,Yes,No,Yes,No,Yes,No,Juice Concotion(Strong),Juice Concotion(Strong),Missing,Missing,,,No,No,No,No,No,No,Yes,No,Missing,Missing,,,Don't Know,Don't Know,Missing,Missing,,,"hiv.Cervical/ Vaginal drugs- Piercing objects (e.g. sticks, wires, knitting needles)",,,,,"hiv.Cervical/ Vaginal drugs- Piercing objects (e.g. sticks, wires, knitting needles)",,,,,e. Medication abortion (e.g. Cytotec/misoprostol),,,,,e. Medication abortion (e.g. Cytotec/misoprostol),,,,,e. Medication abortion (e.g. Cytotec/misoprostol),,,,,e. Medication abortion (e.g. Cytotec/misoprostol),,,,,e. Medication abortion (e.g. Cytotec/misoprostol),,,,,e. Medication abortion (e.g. Cytotec/misoprostol),,,,,Commonly,Never/ Rarely,Never/ Rarely,Sometimes,Never/ Rarely,Commonly,Sometimes,Sometimes,Never/ Rarely,Commonly,Sometimes,Sometimes,Commonly,Commonly,,,,,100,200,500,1000,500,1000,500,1000,1000,1500,500,1000,300,500,,,,,16.574585,11.111111,49.723759,11.111111,2.7624309,16.666666,.55248618,4.4444447,0,1.1111112,8.2872925,22.222221,22.099447,33.333332,Sometimes,Never/ Rarely,Commonly,Never/ Rarely,Commonly,Never/ Rarely,Sometimes,Never/ Rarely,Commonly,Commonly,Commonly,Sometimes,Commonly,Never/ Rarely,,,,,1500,2000,1500,2000,1500,2000,1000,1500,15000,20000,1500,2000,500,1000,,,,,5,0,10,10,20,10,5,15,10,30,40,30,10,5,20,40,30,30,40,40,30,40,5,8,Yes,No,No,No,No,No,No,No,No,No,No,No,No,Yes,No,No,No,No,,,Never/Rarely,Never/Rarely,Commonly,Commonly,Commonly,Commonly,Never/Rarely,Never/Rarely,Never/Rarely,Never/Rarely,Commonly,Commonly,Commonly,Commonly,Commonly,Commonly,,,,,8,3,2,2,2,3,8,6,2,2,2,2,3,6,3,7,Never/ Rarely,Never/ Rarely,Commonly,Sometimes,Commonly,Commonly,Commonly,Commonly,Never/ Rarely,Commonly,Commonly,Commonly,Commonly,Never/ Rarely,,,,,4,4,3,3,2,3,3,5,4,3,3,3,3,3,7,8,Never/ Rarely,Never/ Rarely,Commonly,Sometimes,Commonly,Sometimes,Commonly,Sometimes,Sometimes,Commonly,Commonly,Sometimes,Commonly,Never/ Rarely,,,,,5,8,7,9,Sometimes,Sometimes,Sometimes,Sometimes,Never/Rarely,Commonly,Commonly,Commonly,Commonly,Commonly,,,,Commonly,,,,Commonly,Commonly,,,,,6,Yes,No,No,No,Yes,Yes,No,No,No,Yes,Yes,No,Yes,No,No,Yes,No,,Few of them,None of them,All,Yes,No,Yes,Yes,No,No,Yes,Yes,No,No,No,No,No,No,No,No,No,No,,Abortion Is A Crime.,No Difference.,No Change.,Not Really .,Government To Intensify On Arresting Quakes Who Are Pros Ofback Street Abortion.,Yes,No,No,No,No,No,No,,Yes,No,No,No,No,Yes,Yes,No,,More Improved Counselling With Right Attitude.Educating On Dangers Of Abortion And Availability Of Pac Services To The Public.,No Comment.,15,55
